Product Brand,Product Name,Product Rating,Product Rating & Review Count,Product Original Price,Product Offer Price,Product Discount,Product Highlight,Product Stock Status
L'Oreal Paris,"L'Oreal Paris Voluminous Panorama Waterproof Mascara Volumizing, Clump Free, Smudge free(9.4ml)",4.4/5,1551ratings&281reviews,₹999,₹849,15% Off,BESTSELLER,In Stock
L'Oreal Paris,L'Oreal Paris Color Riche Satin Lipstick - 124 S'il Vous Plait(4.3g),4.3/5,129ratings&46reviews,₹750,₹713,5% Off,None,In Stock
L'Oreal Paris,L'Oreal Paris Infallible Matte Resistance Liquid Lipstick - 635 Worth It Medium(5g),4.3/5,6417ratings&739reviews,₹999,₹899,10% Off,BESTSELLER,In Stock
L'Oreal Paris,L'Oreal Paris Voluminous Lash Paradise Mascara - 204 Blackest Black(7.6ml),4.4/5,18731ratings&2992reviews,₹899,₹764,15% Off,None,In Stock
L'Oreal Paris,"L'Oreal Paris Extraordinary Oil Hair Serum, Anti-Frizz Serum With UV Protection(100ml)",4.5/5,80981ratings&7073reviews,₹729,₹693,5% Off,BESTSELLER,In Stock
L'Oreal Paris,L'Oreal Paris Glycolic Bright 8% [Melasyl + Niacinamide] Face Serum for Brightening Dark Spots(30ml),4.3/5,24379ratings&1237reviews,₹749,₹674,10% Off,BESTSELLER,In Stock
L'Oreal Paris,L'Oreal Paris Hyaluron Moisture Anti-frizz Conditioner With Hyaluronic Acid for 72 HR Hydrated Hair(386ml),4.5/5,43812ratings&2528reviews,₹599,₹539,10% Off,BESTSELLER,In Stock
L'Oreal Paris,"L’Oréal Paris Hyaluron Pure 72H Purifying Shampoo, For Oily Scalp & Dry Hair With Salicylic And Hyaluronic Acid(200ml)",4.6/5,27ratings&10reviews,₹259,N/A,No Discount,None,In Stock
L'Oreal Paris,"L'Oreal Paris Revitalift Serum, Hydrating and Plumping, Replumps Skin in 1H, Reduces Fine Lines(30ml)",4.4/5,45010ratings&2923reviews,₹999,₹899,10% Off,BESTSELLER,In Stock
L'Oreal Paris,Loreal Paris Revitalift Hyaluronic Acid Line Filling Water Cream With Ceramides For Hydration & Barrier Repair(50ml),4.4/5,11610ratings&501reviews,₹999,₹949,5% Off,None,In Stock
L'Oreal Paris,LOreal Paris Hyaluron Moisture Anti-frizz Shampoo With Hyaluronic Acid For 72 HR Dehydrated Hair(1L),4.4/5,34030ratings&1974reviews,₹1439,₹1295,10% Off,BESTSELLER,In Stock
L'Oreal Paris,"LOreal Paris Infallible Full Wear Concealer, Maximum Coverage, Sweat Proof & Heat Proof - Amber 312(10ml)",4.4/5,15547ratings&1469reviews,₹849,₹807,5% Off,BESTSELLER,In Stock
L'Oreal Paris,L'Oreal Paris Hyaluron Moisture Anti-frizz Leave-in Night Cream With Hyaluronic Acid For Hydrated Hair(180ml),4.3/5,13352ratings&1026reviews,₹499,N/A,No Discount,None,In Stock
L'Oreal Paris,L'Oreal Paris Dream Lengths No Haircut Cream Leave-In Formula With Vitamins and Castor Oil(200ml),4.5/5,15956ratings&1809reviews,₹549,N/A,No Discount,None,In Stock
L'Oreal Paris,L'Oreal Paris Magic Retouch Instant Root Concealer Hair Color - 2 Dark Brown(75ml),4.1/5,23552ratings&1817reviews,₹299,N/A,No Discount,None,In Stock
L'Oreal Paris,L'Oreal Paris Casting Creme Gloss Conditioning Hair Color - 400 Dark Brown(87.5g + 72ml),4.3/5,16579ratings&1669reviews,₹699,N/A,No Discount,None,In Stock
L'Oreal Paris,"LOreal Paris Liquid Foundation, Infaillible 32H Fresh Wear, Oil Absorbing Formula, Warm Dore 125 SPF 25(30ml)",4.3/5,7449ratings&744reviews,₹1099,₹989,10% Off,None,In Stock
L'Oreal Paris,L'Oreal Paris Dream Lengths Restoring Shampoo For Long Damaged Hair(650ml),4.4/5,20391ratings&1333reviews,₹879,N/A,No Discount,None,In Stock
L'Oreal Paris,L'Oreal Paris Color Riche Intense Volume Matte Lipstick - 570 Worth It Intense(2g),4.3/5,908ratings&108reviews,₹999,₹849,15% Off,None,In Stock
L'Oreal Paris,L'Oreal Paris Glycolic Bright Day Cream With SPF17 Glycolic Acid & Niacinamide Reduces Dark Spots(50ml),4.3/5,12685ratings&445reviews,₹729,₹693,5% Off,None,In Stock
L'Oreal Paris,L'Oreal Paris Hyaluron Moisture Combo for 72HR Hydrated Hair Shampoo + Conditioner(2 pcs),4.4/5,54005ratings&2929reviews,₹1738,₹1477,15% Off,None,In Stock
L'Oreal Paris,L'Oreal Paris Excellence Creme Triple Care Hair Color - 3 Dark Brown(72ml + 100g),4.4/5,12586ratings&1077reviews,₹729,N/A,No Discount,None,In Stock
L'Oreal Paris,"L'Oreal Paris Infallible 24H Fresh Wear Foundation in a Powder, Transferproof, Ivoire Ivory 20(9 g)",4.1/5,6107ratings&393reviews,₹1099,₹1044,5% Off,None,In Stock
L'Oreal Paris,L'Oreal Paris Glycolic Bright Dark Circle Eye Serum With 3% Glycolic + Niacinamide + Vitamin C(20ml),4.3/5,4442ratings&198reviews,₹699,₹664,5% Off,None,In Stock
L'Oreal Paris,L'Oreal Paris Glycolic Bright Daily Foaming Face Cleanser With Glycolic Acid For Dull Skin(100ml),4.4/5,14350ratings&675reviews,₹329,₹313,5% Off,None,In Stock
L'Oreal Paris,L'Oreal Paris Extraordinary Oil Nourishing Shampoo For Dry & Dull Hair(1000ml),4.4/5,13303ratings&1130reviews,₹1409,₹1268,10% Off,None,In Stock
L'Oreal Paris,L'Oreal Paris Glycolic Bright Night Cream With Glycolic Acid & Niacinamide Skin Brightening Cream(15ml),4.3/5,7628ratings&240reviews,₹399,N/A,No Discount,None,In Stock
L'Oreal Paris,L'Oreal Paris Hyaluron Moisture Combo for 72HR Hydrated Hair Shampoo + Conditioner + Night Cream(3 pcs),4.4/5,67356ratings&3962reviews,₹2237,₹2013,10% Off,None,In Stock
L'Oreal Paris,L'Oreal Paris Dream Lengths Detangling Conditioner For Long Damaged Hair(180ml),4.5/5,21879ratings&1430reviews,₹269,₹242,10% Off,None,In Stock
L'Oreal Paris,L'Oreal Paris Revitalift Laser X3 Day Cream With Pro-Retinol(50ml),4.4/5,2563ratings&165reviews,₹1679,₹1595,5% Off,None,In Stock
L'Oreal Paris,L'Oreal Paris Total Repair 5 Repairing Shampoo With Keratin XS For Damaged Hair(1L),4.4/5,14114ratings&964reviews,₹1229,₹1045,15% Off,None,In Stock
L'Oreal Paris,"L'Oréal Paris Total Repair 5 Shampoo , Conditioner & Serum Combo- Restores Damaged Hair(650ml + 180ml + 40ml)",4.4/5,8047ratings&449reviews,₹1577,₹1262,20% Off,None,In Stock
L'Oreal Paris,"L'Oreal Paris Hydrated, Plump & Radiant Skin Kit(3 pcs)",4.4/5,57789ratings&3144reviews,₹1387,₹1040,25% Off,None,In Stock
L'Oreal Paris,L'Oreal Paris Rouge Signature Matte Liquid Lipstick - 116 I Explore(7ml),4.2/5,14138ratings&2975reviews,₹899,N/A,No Discount,None,In Stock
L'Oreal Paris,LOreal Paris True Match Super-Blendable Foundation Neutral Undertone(30ml),4.2/5,8692ratings&1608reviews,₹1099,N/A,No Discount,None,In Stock
L'Oreal Paris,L'Oreal Paris Extraordinary Oil Nourishing Conditioner For Dull & Dry Hair Makes Hair Smooth(180ml),4.4/5,10487ratings&891reviews,₹269,₹256,5% Off,None,In Stock
L'Oreal Paris,"L'Oreal Paris Revitalift Gel Cleanser, For Fresh, Hydrated & Youthful Skin, with Hyaluronic Acid(100ml)",4.4/5,10693ratings&484reviews,₹349,₹332,5% Off,None,In Stock
L'Oreal Paris,L'Oreal Paris Dream Lengths 2 Step Combo for Long Damaged Hair - Shampoo + Conditioner(2 pcs),4.4/5,42275ratings&2765reviews,₹1148,₹1033,10% Off,None,In Stock
L'Oreal Paris,L'Oreal Paris Revitalift Anti-Wrinkle And Firming Night Cream(50ml),4.4/5,3473ratings&217reviews,₹1049,₹997,5% Off,None,In Stock
L'Oreal Paris,L'Oreal Paris Total Repair 5 Hair Serum(80ml),4.4/5,12782ratings&1256reviews,₹399,₹359,10% Off,None,In Stock
L'Oreal Paris,"L'Oreal Paris UV Defender Serum Protector Sunscreen With SPF 50 PA+++, Bright & Clear(50ml)",4.2/5,3340ratings&258reviews,₹799,₹719,10% Off,None,In Stock
L'Oreal Paris,L'Oreal Paris Revitalift Anti-Wrinkles + Radiance Moisturizing Cream Day SPF 35 PA++(50ml),4.4/5,4078ratings&284reviews,₹1049,₹997,5% Off,None,In Stock
L'Oreal Paris,L'Oreal Paris Revitalift Hyaluronic Acid Eye Serum With 2.5% Hyaluronic Acid + Caffeine(20ml),4.3/5,2893ratings&198reviews,₹899,₹854,5% Off,None,In Stock
L'Oreal Paris,L'Oreal Paris Revitalift Crystal Micro-Essence With Salicylic Acid(22ml),4.3/5,31519ratings&3847reviews,₹379,N/A,No Discount,None,In Stock
L'Oreal Paris,L'Oreal Paris Glycolic Bright Day Regime(3 pcs),4.3/5,27149ratings&846reviews,₹1327,₹1194,10% Off,None,In Stock
L'Oreal Paris,L'Oreal Paris Infallible Oil Killer Powder - Rose Vanilla(6g),4.3/5,1862ratings&93reviews,₹899,N/A,No Discount,None,In Stock
L'Oreal Paris,L'Oreal Paris Elnett Strong Hold Hair Spray(400ml),4.2/5,2712ratings&352reviews,₹750,N/A,No Discount,None,In Stock
L'Oreal Paris,L'Oreal Paris Colour Protect Shampoo With UVA & UVB For Colour-Treated Hair(340ml),4.4/5,11655ratings&1359reviews,₹459,N/A,No Discount,None,In Stock
L'Oreal Paris,L'Oreal Paris Glycolic Bright Kit(3 pcs),4.3/5,26275ratings&777reviews,₹1497,N/A,No Discount,None,In Stock
L'Oreal Paris,L'Oreal Paris Total Repair 5 Restoring Conditioner With Keratin XS For Damaged Hair(180ml),4.5/5,12565ratings&1090reviews,₹259,₹228,12% Off,None,In Stock
L'Oreal Paris,L'Oreal Paris True Match Super Blendable Powder - G3/W3 Golden Beige(9gm),4.4/5,15739ratings&1517reviews,₹999,N/A,No Discount,None,In Stock
L'Oreal Paris,L'Oreal Paris Dermo Expertise Lip and Eye Makeup Remover(125ml),4.6/5,2472ratings&342reviews,₹499,N/A,No Discount,None,In Stock
L'Oreal Paris,L'Oreal Paris Hyaluron Pure 72H Rehydrating Conditioner(175ml),4.6/5,18ratings&6reviews,₹299,₹284,5% Off,None,In Stock
L'Oreal Paris,L'Oreal Paris Extraordinary Oil Hair Combo For Shiny & Frizz Free Hair(3 pcs),4.5/5,104773ratings&9095reviews,₹1497,₹1272,15% Off,None,In Stock
L'Oreal Paris,L'Oreal Paris Fall Resist 3x Shampoo(180ml),4.4/5,5553ratings&421reviews,₹219,N/A,No Discount,None,In Stock
L'Oreal Paris,L'Oreal Paris Long Hair Dreams,4.4/5,58275ratings&4599reviews,₹1697,₹1527,10% Off,None,In Stock
L'Oreal Paris,L'Oreal Paris Total Repair 5 Hair Masque With Protien + Ceramide For Damaged & Weak Hair(200gm),4.4/5,2710ratings&348reviews,₹499,N/A,No Discount,None,In Stock
L'Oreal Paris,L'Oreal Paris Revitalift Triple Action Anti-Aging Eye Cream(15ml),4.3/5,1349ratings&147reviews,₹1299,N/A,No Discount,None,In Stock
L'Oreal Paris,L'Oreal Paris Infallible 32H Matte Cover Liquid Foundation 30 Neutral Undertone(35ml),4.2/5,6192ratings&913reviews,₹899,N/A,No Discount,None,In Stock
L'Oreal Paris,L'Oreal Paris Revitalift Triple Action Night Cream-Mask(50ml),4.4/5,1535ratings&111reviews,₹1679,₹1595,5% Off,None,In Stock
L'Oreal Paris,L'Oreal Paris Fall Resist 3x Shampoo(650ml),4.4/5,1582ratings&127reviews,₹1069,N/A,No Discount,None,In Stock
L'Oreal Paris,L'Oreal Paris Casting Creme Gloss Ultra Visible Conditioning Hair Color - 632 Light Golden Brown(100gm+60ml),4.2/5,2034ratings&154reviews,₹729,N/A,No Discount,None,In Stock
L'Oreal Paris,L'Oreal Paris Infaillible Grip Upto 36H Gel Automatic Eye Liner - 001 Intense Black(5g),4.4/5,80ratings&7reviews,₹899,N/A,No Discount,None,In Stock
L'Oreal Paris,L'Oreal Paris Kajal Magique Bold - Black(0.35g),4.5/5,2749ratings&297reviews,₹449,N/A,No Discount,None,In Stock
L'Oreal Paris,L'Oreal Paris Revitalift Intensive Repairing Essence With Pro Retinol-A(30ml),4.4/5,754ratings&27reviews,₹1899,N/A,No Discount,None,In Stock
L'Oreal Paris,L'Oreal Paris Chiffon Signature - 225 Grasp(7ml),4.2/5,1308ratings&186reviews,₹999,N/A,No Discount,None,In Stock
L'Oreal Paris,L'Oreal Paris Infaillible Grip 24H Matte Liquid Liner - 01 Matte Black(10.8g),4.1/5,68ratings&5reviews,₹899,N/A,No Discount,None,In Stock
L'Oreal Paris,L'Oreal Paris Fall Resist 2 Step Combo for Hair Fall Control - Shampoo + Conditioner(2 pcs),4.4/5,3957ratings&214reviews,₹1348,N/A,No Discount,None,In Stock
L'Oreal Paris,L'Oreal Paris Super Liner Gel Intenza 36H - Profound Black(2.8g),4.4/5,3180ratings&565reviews,₹999,N/A,No Discount,None,In Stock
L'Oreal Paris,L'Oreal Paris Super Liner Super Star Duo Designer - Black(0.1gm+0.55gm),4.3/5,1701ratings&379reviews,₹999,N/A,No Discount,None,In Stock
L'Oreal Paris,L'Oreal Paris Glycolic Acid Glowing And Protecting C-S-M-S Regime Kit(3 pcs),4.3/5,25830ratings&973reviews,₹1776,N/A,No Discount,None,In Stock
L'Oreal Paris,L'Oreal Paris Fall Resist 3x Anti-Hair Fall Conditioner For Fragile Hair(180ml),4.4/5,3317ratings&210reviews,₹279,N/A,No Discount,None,In Stock
L'Oreal Paris,L'Oreal Paris Extraordinary Oil 2 Step Anti-Frizz Combo - Shampoo + Conditioner(2 pcs),4.4/5,23790ratings&2021reviews,₹1678,₹1594,5% Off,None,In Stock
L'Oreal Paris,L'Oreal Paris Colour Protecting Conditioner For Coloured Hair With UVA/UVB Filters(180ml),4.5/5,3542ratings&247reviews,₹269,N/A,No Discount,None,In Stock
L'Oreal Paris,L'Oreal Paris 6 Oil Nourish Rapid Reviver Conditioner For Dry Hair(180ml),4.5/5,2304ratings&355reviews,₹240,N/A,No Discount,None,In Stock
L'Oreal Paris,L'Oreal Paris Brow Artist Xpert - 107 Cool Brunette(0.2g),4.4/5,1166ratings&155reviews,₹849,N/A,No Discount,None,In Stock
L'Oreal Paris,L'Oreal Paris Casting Creme Gloss Hair Color - Medium Brown 500(87.5gm+72ml),4.4/5,827ratings&43reviews,₹679,N/A,No Discount,None,In Stock
L'Oreal Paris,L'Oreal Paris Total Repair 5 2 Step Combo for Damage Repair - Shampoo + Conditioner(2 pcs),4.4/5,26679ratings&2054reviews,₹1488,₹1339,10% Off,None,In Stock
L'Oreal Paris,L'Oreal Paris Kajal Magique - Supreme Black(0.35g),4.4/5,2415ratings&259reviews,₹299,N/A,No Discount,None,In Stock
L'Oreal Paris,L'Oreal Paris Elnett Satin Normal Hold Hair Spray(400ml),4.2/5,828ratings&84reviews,₹750,N/A,No Discount,None,In Stock
L'Oreal Paris,L'Oreal Paris Total Repair 5 Rapid Reviver Conditioner With Micro Ceramide For Damaged Hair(180ml),4.5/5,1532ratings&218reviews,₹240,N/A,No Discount,None,In Stock
L'Oreal Paris,"L'Oreal Paris Anti-Dark Spot, Glycolic Acid Skin Brightening Combo : Melasyl Serum + Cream",4.3/5,20942ratings&641reviews,₹1098,₹988,10% Off,None,In Stock
L'Oreal Paris,L'Oreal Paris Infallible Matte Resistance Lipstick -Pack of 2(1pcs),4.4/5,1372ratings&208reviews,₹1998,₹1898,5% Off,None,In Stock
L'Oreal Paris,L'Oreal Paris Revitalift Hyaluronic Acid & Skin Barrier Boosting Duo(2 Pcs),4.4/5,51577ratings&3040reviews,₹1528,₹1452,5% Off,None,In Stock
L'Oreal Paris,L'Oreal Paris Volume Million Lashes Mascara Extra-Black(10.7ml)(10.7ml),4.2/5,1072ratings&287reviews,₹999,N/A,No Discount,None,In Stock
L'Oreal Paris,L'Oreal Paris Revitalift Crystal Micro-Essence Brightening Sheet Mask(25g),4.4/5,2002ratings&138reviews,₹159,N/A,No Discount,None,In Stock
L'Oreal Paris,L'Oreal Paris Infaillible Grip Micro Fine Liner - 01 Obsidian Black(0.4g),4.3/5,31ratings&7reviews,₹999,N/A,No Discount,None,In Stock
L'Oreal Paris,L'Oreal Paris Revitalift Hyaluronic Acid Fresh Mix Serum Hydrating Sheet Mask(33g),4.4/5,1817ratings&121reviews,₹199,N/A,No Discount,None,In Stock
L'Oreal Paris,L'Oreal Paris Infallible Lasting Primer(30ml),4.3/5,280ratings&11reviews,₹899,N/A,No Discount,None,In Stock
L'Oreal Paris,L'Oreal Paris Glycolic Bright Night Regime(3 pcs),4.3/5,24772ratings&802reviews,₹1377,N/A,No Discount,None,In Stock
L'Oreal Paris,L'Oreal Paris Revitalift 1.5% Hyaluronic Acid Serum(2 pcs),4.4/5,45010ratings&2923reviews,₹1258,N/A,No Discount,None,In Stock
L'Oreal Paris,L'Oreal Paris UV Defender Invisible Resist Daily Sunscreen SPF 50+ PA++++(50ml),4.7/5,6ratings&2reviews,₹699,N/A,No Discount,None,In Stock
L'Oreal Paris,L'Oreal Paris Casting Creme Gloss Ultra Visible Conditioning Hair Color - 532 Salted Caramel(160g),4.4/5,212ratings&10reviews,₹729,N/A,No Discount,None,In Stock
L'Oreal Paris,L'Oreal Paris Excellence Creme Hair Color - 4.2 Plum Brown(100gm +72ml),4.4/5,422ratings&24reviews,₹719,N/A,No Discount,None,In Stock
L'Oreal Paris,L'Oreal Paris Excellence Fashion Hair Color - Shade 5.54 Intense Warm Auburn(172ml),4.4/5,185ratings&15reviews,₹719,N/A,No Discount,None,In Stock
L'Oreal Paris,"L'Oreal Paris Glycolic Bright Glowing Serum Sheet Mask, Face Mask for Glowing Skin(22g)",4.4/5,877ratings&22reviews,₹229,N/A,No Discount,None,In Stock
L'Oreal Paris,L'Oreal Paris Excellence Fashion Hair Color - Shade 9.13 Golden Beige Blonde(172ml),4.3/5,395ratings&27reviews,₹719,N/A,No Discount,None,In Stock
L'Oreal Paris,L'Oreal Paris Bestseller's Regime Nourishment Kit,4.5/5,104774ratings&9095reviews,₹1417,N/A,No Discount,None,In Stock
L'Oreal Paris,L'Oreal Paris Excellence Fashion Hair Color - Shade 6.34 Intense Golden Auburn(172ml),4.2/5,220ratings&12reviews,₹719,N/A,No Discount,None,In Stock
L'Oreal Paris,L'Oreal Paris Total Repair 5 Damage Repair Combo,4.4/5,16824ratings&1312reviews,₹898,₹808,10% Off,None,In Stock
L'Oreal Paris,L'Oreal Paris Glycolic Bright Instant Glow Face + Eye Serum Duo(2 pcs),4.3/5,14813ratings&705reviews,₹1098,N/A,No Discount,None,In Stock
L'Oreal Paris,L'Oreal Paris Hyaluronic Acid Hydrating And Protecting C-S-M-S Regime Kit(3 pcs),4.4/5,58464ratings&3174reviews,₹2186,₹2077,5% Off,None,In Stock
L'Oreal Paris,L'Oreal Paris Le Bar Mono Color Powder Blush - 10 Play With Me(4.5gm),4.4/5,488ratings&92reviews,₹999,N/A,No Discount,None,In Stock
L'Oreal Paris,Loreal Paris Liner Magique 100% Black(3g),4.4/5,365ratings&55reviews,₹550,N/A,No Discount,None,In Stock
L'Oreal Paris,L'Oreal Paris Revitalift Face + Eye Hydrating Serums Duo With Hyaluronic Acid(2 pcs),4.4/5,47903ratings&3121reviews,₹1528,₹1452,5% Off,None,In Stock
L'Oreal Paris,L'Oreal Paris Le Blush Bar Highlighter - 16 Be Brave(4.5gm),4.2/5,225ratings&31reviews,₹999,N/A,No Discount,None,In Stock
L'Oreal Paris,L'Oreal Paris La Petite Eyeshadow Palette - Maximalist(4gm),4.4/5,590ratings&64reviews,₹1299,₹1105,15% Off,None,In Stock
L'Oreal Paris,L'Oreal Paris Casting Creme Gloss Hair Color - 300 Darkest Brown + Magic Retouch Instant Root Concealer - 2 Dark Brown,4.3/5,31994ratings&2733reviews,₹978,N/A,No Discount,None,In Stock
L'Oreal Paris,L'Oreal Paris Plump & Radiant Kit,4.4/5,53396ratings&3162reviews,₹1357,N/A,No Discount,None,In Stock
L'Oreal Paris,L'Oreal Paris Extraordinary Hair Kit(3 PCs),4.5/5,104773ratings&9094reviews,₹1977,N/A,No Discount,None,In Stock
L'Oreal Paris,L'Oreal Paris Cannes Icons Collection - Lip & Lash Duo(2 pcs),4.4/5,2209ratings&351reviews,₹1998,N/A,No Discount,None,In Stock
L'Oreal Paris,L'Oreal Paris Hydrating & Smoothening Combo For Dry Hair(2 pcs),4.5/5,95230ratings&7758reviews,₹1738,₹1564,10% Off,None,In Stock
L'Oreal Paris,L'Oreal Paris Pack Of Two Revitalift Crystal Micro-Essence(2 pcs),4.2/5,25189ratings&2474reviews,₹1268,N/A,No Discount,None,In Stock
L'Oreal Paris,L'Oreal Paris Hair Colour Protection Combo - Casting Creme Gloss Hair Colour 400 Dark Brown + Magic Retouch,4.3/5,31995ratings&2733reviews,₹998,N/A,No Discount,None,In Stock
L'Oreal Paris,L'Oreal Paris Paradise Eyes Kit - Lash Paradise Mascara & Superliner Gel Intenza(2 pcs),4.4/5,21908ratings&3557reviews,₹1898,N/A,No Discount,None,In Stock
L'Oreal Paris,L'Oreal Paris Infallible Ultra Matte Liquid Les Macarons Lipstick - 838 Berry Cherie(5ml),4.1/5,746ratings&157reviews,₹799,N/A,No Discount,None,In Stock
L'Oreal Paris,L'Oreal Paris Casting Creme Gloss Hair Color - 200 Ebony Black + Magic Retouch Instant Root Concealer - 2 Dark Brown,4.3/5,31994ratings&2733reviews,₹998,N/A,No Discount,None,In Stock
L'Oreal Paris,L'Oreal Paris Paradise Beauty Bestsellers - Lash Paradise Mascara & Ha Serum(2 pcs),4.4/5,63737ratings&5915reviews,₹1528,N/A,No Discount,None,In Stock
L'Oreal Paris,L'Oreal Paris Alia’s Worth It Combo(2 Pcs),4.4/5,2354ratings&422reviews,₹1998,₹1898,5% Off,None,In Stock
L'Oreal Paris,L'Oreal Paris Casting Creme Gloss Hair Color - Mahogany + Magic Retouch Instant Root Concealer - 2 Dark Brown,4.3/5,31994ratings&2733reviews,₹1028,N/A,No Discount,None,In Stock
L'Oreal Paris,L'Oreal Paris Casting Creme Gloss Hair Color - 316 Plum + Magic Retouch Instant Root Concealer - 1 Black,4.2/5,40131ratings&3486reviews,₹1068,N/A,No Discount,None,In Stock
L'Oreal Paris,L'Oreal Paris Casting Creme Gloss Conditioning Hair Color - 400 Dark Brown + Magic Retouch Instant Root Concealer - 2 Dark Brown,4.3/5,31994ratings&2733reviews,₹998,N/A,No Discount,None,In Stock
L'Oreal Paris,L'Oreal Paris Casting Creme Gloss Hair Color - 530 Praline Brown + Magic Retouch Instant Root Concealer - 2 Dark Brown,4.3/5,31994ratings&2733reviews,₹998,N/A,No Discount,None,In Stock
L'Oreal Paris,L'Oreal Paris Casting Creme Gloss Hair Color - 530 Praline Brown + Magic Retouch Instant Root Concealer - 1 Black,4.2/5,40131ratings&3486reviews,₹1068,N/A,No Discount,None,In Stock
L'Oreal Paris,L'Oreal Paris Casting Creme Gloss Hair Color - 316 + Magic Retouch Instant Root Concealer - 2 Dark Brown,4.3/5,31994ratings&2733reviews,₹998,N/A,No Discount,None,In Stock
L'Oreal Paris,L'Oreal Paris Aura Perfect Day Cream & Moisturizer With Vitamin C(50ml),4.3/5,2727ratings&255reviews,₹649,N/A,No Discount,None,Out Of Stock
L'Oreal Paris,L'Oreal Paris Le Bar Powder Blush - 8 City Explorer(4.5gm),4/5,110ratings&14reviews,₹849,N/A,No Discount,None,Out Of Stock
L'Oreal Paris,"L'Oreal Paris Extraordinary Oil Smooth Steam Mask, Nourishing for Smooth & Frizz-Free Hair(20ml + 40g)",4.4/5,3977ratings&381reviews,₹399,N/A,No Discount,None,Out Of Stock
L'Oreal Paris,L'Oreal Paris Flash Cat Eye Eyeliner - Black(0.6g),4.3/5,979ratings&145reviews,₹799,N/A,No Discount,None,Out Of Stock
L'Oreal Paris,L'Oreal Paris Skin Perfect Age 40+ Anti-Aging Cream With SPF 21 & PA +++(50g),4.3/5,2438ratings&233reviews,₹649,N/A,No Discount,None,Out Of Stock
L'Oreal Paris,L'Oreal Paris Superliner Black Lacquer(1ml),4.1/5,870ratings&132reviews,₹799,N/A,No Discount,None,Out Of Stock
L'Oreal Paris,L'Oreal Paris Revitalift Triple Action Night Cream(50ml),4.3/5,9ratings,₹1400,N/A,No Discount,None,Out Of Stock
L'Oreal Paris,L'Oreal Paris True Match Super-Blendable Foundation With Hydrating Hyaluronic Acid - 6.5W Warm(30ml),4.4/5,67ratings&7reviews,₹1099,N/A,No Discount,None,In Stock
