Product Brand,Product Name,Product Rating,Product Rating & Review Count,Product Original Price,Product Offer Price,Product Discount,Product Highlight,Product Stock Status
Lakme,Lakme Rouge Bloom Matte Lip Liquid - Blushing Bae 204(3.5ml),4.8/5,202ratings&156reviews,₹1199,N/A,No Discount,None,In Stock
Lakme,"Lakme Xtraordin-Airy Mattereal Mousse Foundation, Matte Finish, With SPF8, 01 Classic Ivory(25g)",4.4/5,51630ratings&4709reviews,₹999,₹599,40% Off,BESTSELLER,In Stock
Lakme,"Lakme Sun Expert Dry Matte Fluid SPF 50++++ Sunscreen with 1% Niac & Ceramide, for Oily Skin(50ml)",4.9/5,430ratings&410reviews,₹499,₹449,10% Off,None,In Stock
Lakme,"Lakme 9 To 5 Powerplay Priming Foundation, Built In Primer, SPF 25, W120 Warm Creme(25ml)",4.4/5,47870ratings&3163reviews,₹699,₹384,45% Off,None,In Stock
Lakme,"Lakme Unreal Undercover Gel Face Primer, Enriched With Viitamin E(30ml)",4.4/5,75912ratings&5068reviews,₹899,₹539,40% Off,None,In Stock
Lakme,Lakme Lumi Lit Strobe Cream Highlighter + Moisturizer + Primer With Hyaluronic Acid & Niacinamide Dewy Rose(30g),4.3/5,52935ratings&2407reviews,₹349,₹332,5% Off,BESTSELLER,In Stock
Lakme,Lakme Xtraordin-Airy Velvet Matte Lip Mousse - 103 Dark Cherry(4.6 g),4.3/5,9698ratings&696reviews,₹900,₹585,35% Off,None,In Stock
Lakme,"Lakme Ultimate Glam Compact, Skin Lightening Compact Powder With Vitamin B3, Golden Sand 03(8gm)",4.4/5,10540ratings&805reviews,₹290,₹203,30% Off,None,In Stock
Lakme,Lakme Perfect Radiance Brightening Day Cream With Sunscreen Protection(50g),4.3/5,42515ratings&1765reviews,₹375,₹338,10% Off,BESTSELLER,In Stock
Lakme,"Lakme 9 To 5 Powerplay Priming Powder Foundation Lasting Matte, Ivory Cream(9g)",4.3/5,47859ratings&2581reviews,₹649,₹402,38% Off,None,In Stock
Lakme,"Lakme 9 To 5 Powerplay Priming Concealer Built In Primer, Hydrating, 10 Ivory(5.4ml)",4.3/5,17395ratings&628reviews,₹575,₹357,38% Off,None,In Stock
Lakme,Lakme Vitamin C Superglow Skin Perfecting Makeup Fixer with 1 % Vit C(60ml),4.4/5,1395ratings&118reviews,₹325,₹302,7% Off,None,In Stock
Lakme,Lakme Superglow Vit C Gloss - Insta Pink(2.5ml),4.2/5,12ratings&2reviews,₹350,₹315,10% Off,None,In Stock
Lakme,"Lakme 9 To 5 Eyeconic Liquid Eyeliner Smudgeproof, Waterproof, Lasts Upto 24 Hrs, Black(4.5ml)",4.4/5,56956ratings&2910reviews,₹299,₹209,30% Off,BESTSELLER,In Stock
Lakme,Lakme Peach Milk Moisturizer(200ml),4.5/5,6422ratings&214reviews,₹435,₹392,10% Off,None,In Stock
Lakme,"Lakme Forever Matte Liquid Lip Color, Lightweight & Transferproof 08 Nude Dream(5.6ml)",4.4/5,124376ratings&9913reviews,₹429,₹322,25% Off,None,In Stock
Lakme,"Lakme 9 To 5 Powerplay Priming Matte Lipstick, Lasts hrs, Rosy Sunday(3.6g)",4.2/5,70589ratings&2971reviews,₹650,₹403,38% Off,BESTSELLER,In Stock
Lakme,Lakme 9 To 5 CC Cream With SPF 30 PA++ And 3% Niacinamide Tinted Moisturizer To Conceal Dark Spots(30g),4.4/5,70320ratings&5536reviews,₹399,₹359,10% Off,BESTSELLER,In Stock
Lakme,Lakme Eyeconic Kajal Deep Black Twist Up Pencil & Matte Finish - Pack of 2(0.7gm),4.5/5,32301ratings&803reviews,₹420,₹294,30% Off,BESTSELLER,In Stock
Lakme,"Lakme Forever Matte Lipstick, Made With French Rose Oil Extracts, Burgundy Bloom(4.5g)",4.2/5,43187ratings&1950reviews,₹349,₹262,25% Off,None,In Stock
Lakme,"Lakme 9 To 5 Double Duty Lip & Cheek Mousse Matte Lipstick & Soft Blush, Blush Velvet(9g)",4.2/5,52626ratings&8427reviews,₹725,₹450,38% Off,None,In Stock
Lakme,"Lakme Xtraordin-Airy Compact, 2 In 1 Compact + Foundation, Lightweight, SPF17, 01 Ivory Fair(9g)",4.3/5,24494ratings&2070reviews,₹975,₹634,35% Off,None,In Stock
Lakme,"Lakme 9 To 5 Eyeconic Kajal, Waterproof, Smudgeproof, Lasts 24 Hrs, Sparkling Black(0.35 g)",4.4/5,46750ratings&4804reviews,₹275,₹193,30% Off,None,In Stock
Lakme,"Lakme 9 To 5 Eyeconic Curling Mascara, Smudgeproof, Waterproof, Lasts Upto 24 Hrs, Black(6ml)",4.4/5,27605ratings&1955reviews,₹450,₹315,30% Off,None,In Stock
Lakme,Lakme Peach Milk Soft Creme Face Moisturizer(300g),4.5/5,38890ratings&2684reviews,₹712,₹534,25% Off,None,In Stock
Lakme,"Lakme Unreal Mini Blurfect Face Primer, Mattifies & Blurs Pores(10ml)",4.3/5,37598ratings&1883reviews,₹350,₹280,20% Off,None,In Stock
Lakme,"Lakme Ultimate Glam Eye Liner, Semi Matte, Black(9ml)",4.3/5,86245ratings&7984reviews,₹190,₹181,5% Off,None,In Stock
Lakme,"Lakme Matte Sunscreen SPF 50 PA+++, Niacinamide,UVA/B Protection,For Normal To Oily Skin(100ml)",4.3/5,35037ratings&1901reviews,₹625,₹563,10% Off,None,In Stock
Lakme,Lakme Absolute Perfect Radiance Brightening Face Serum with 98% Pure Niacinamide 2X Skin Brightening(30ml),4.3/5,11352ratings&1109reviews,₹649,₹584,10% Off,None,In Stock
Lakme,"Lakme Unreal Precision Liquid Eye Liner Lightweight & Smudgeproof Eye Liner, Black(4.5ml)",4.3/5,37500ratings&4630reviews,₹699,₹454,35% Off,None,In Stock
Lakme,"Lakme Peach Ceramide Moisturizer With SPF 24 For Dry Skin, Normal Skin & Sensitive Skin(200ml)",4.4/5,28137ratings&1870reviews,₹520,₹416,20% Off,None,In Stock
Lakme,"Lakme Sun Expert Tinted Sunscreen SPF 50 PA +++, Broad Spectrum UVA/B protection(100ml)",4.3/5,15937ratings&876reviews,₹625,₹563,10% Off,None,In Stock
Lakme,Lakme 9 to 5 Cc Cream Beige Tinted Moisturizer With SPF 30 Pa++ With Natural Coverage 01 Beige(9g),4.3/5,26507ratings&1777reviews,₹105,N/A,No Discount,None,In Stock
Lakme,"Lakme 9 To 5 Powerplay Matte Compact, Oil Control Formula, With Vitamin E, Melon(9g)",4.4/5,30210ratings&2528reviews,₹599,₹371,38% Off,None,In Stock
Lakme,"Lakme Forever Matte Face Powder, Matte Finish, Oil Control, For Rosy Glow, 02 Warm Pink(40g)",4.4/5,38298ratings&3242reviews,₹229,₹206,10% Off,None,In Stock
Lakme,Lakme 9 To 5 Cc Airy Mousse With Vitamin E & Hint Of Foundation Beige(25g),4.2/5,6952ratings&176reviews,₹525,₹473,10% Off,None,In Stock
Lakme,Lakme Perfect Radiance Night Cream 50g with Niacinamide(50gm),4.4/5,10822ratings&598reviews,₹599,₹539,10% Off,None,In Stock
Lakme,"Lakme True Wear Color Crush Nail Polish, Long Lasting & Vibrant Nail Paint, 404(6ml)",4.2/5,6882ratings&158reviews,₹150,N/A,No Discount,None,In Stock
Lakme,Lakme 9to5 Primer + Matte Liquid Lip Color - MB2 Intense Latte(4.2ml),4/5,13358ratings&715reviews,₹499,₹309,38% Off,None,In Stock
Lakme,"Lakme Absolute Day-N-Night Luminance Kit (Face Wash, Day Cream & Night Cream)",4.3/5,65215ratings&3111reviews,₹1149,₹988,14% Off,None,In Stock
Lakme,Lakme Rouge Bloom Powder Matte Lipstick - Scarlet Rose 209(4g),4.5/5,454ratings&218reviews,₹999,N/A,No Discount,None,In Stock
Lakme,Lakme 9to5 Overtime Shine Tinted Lip Oil - Cocoa Truffle(5.3ml),4.4/5,674ratings&276reviews,₹799,₹679,15% Off,None,In Stock
Lakme,Lakme Blush & Glow Pomegranate Sheet Mask Fruit Facial Like Glow(25ml),4.4/5,15270ratings&556reviews,₹100,₹67,33% Off,None,In Stock
Lakme,Lakme 9 To 5 Lumi Strobe Cream Highlighter + Moisturizer + Primer With Hyaluronic Acid & Niacinamide Dewy Rose(60g),4.3/5,55654ratings&2494reviews,₹549,₹494,10% Off,None,In Stock
Lakme,Lakme Retinol Advanced Renewal Day Creme Pro-Retinol Peptide Complex + Uv Filters & SPF 15 PA++(50 g),4.3/5,3437ratings&114reviews,₹999,₹899,10% Off,None,In Stock
Lakme,Lakme No Makeup Makeup Must Haves(3 pcs),4.3/5,59880ratings&2572reviews,₹1199,₹1055,12% Off,None,In Stock
Lakme,Lakme Liquid Nail Polish Remover With Vitamin E(27ml),4.6/5,22481ratings&1263reviews,₹99,₹79,20% Off,None,In Stock
Lakme,Lakme Perfect Radiance Brightening Facewash With 98% Pure Niacinamide Complexfor Pigmentation(50gm),4.3/5,11910ratings&742reviews,₹175,₹166,5% Off,None,In Stock
Lakme,Lakme Sun Expert SPF 40 PA+++ Ultra Matte Compact with Power of Vitamin E and Iron Oxides(7gm),4.4/5,34995ratings&3315reviews,₹325,₹293,10% Off,None,In Stock
Lakme,"Lakme Forever Matte Compact, Smooth Finish, Lasts For 12 Hrs, Even Toned Look, Marble(9g)",4.4/5,13802ratings&404reviews,₹225,₹214,5% Off,None,In Stock
Lakme,"Lakme Forever Matte Sindoor, Long Lasting, Smudgeproof(5ml)",4.4/5,8882ratings&350reviews,₹175,₹158,10% Off,None,In Stock
Lakme,"Lakme 9 To 5 Powerplay Mousse Foundation, 02 Beige Vanilla(25g)",4.4/5,7433ratings&982reviews,₹750,₹488,35% Off,None,In Stock
Lakme,Lakme Sun Expert SPF 50 Pa++++ 1% Niacinamide + Vitamin C Gel Sunscreen(56 g),4.3/5,1333ratings&235reviews,₹499,₹424,15% Off,None,In Stock
Lakme,Lakme Xtraordin Airy Mattreal Mousse - Ivory Fair(12 g),4.1/5,1354ratings&49reviews,₹499,₹424,15% Off,None,In Stock
Lakme,Lakme Vit C Brilliance - Serum(30ml),4.4/5,17430ratings&1696reviews,₹649,₹584,10% Off,None,In Stock
Lakme,Lakme Color Crush Nailart U4(6ml),4.3/5,36568ratings&3587reviews,₹189,N/A,No Discount,None,In Stock
Lakme,Lakme Absolute Luminous Skin Tint Foundation - Cool Ivory(23ml),4.3/5,1118ratings&46reviews,₹899,₹629,30% Off,None,In Stock
Lakme,Lakme Perfect Radiance Brightening Facewash With 98% Pure Niacinamide Complexfor Pigmentation(50gm),4.3/5,11910ratings&742reviews,₹175,₹166,5% Off,None,In Stock
Lakme,Lakme Eyeconic Pro Brush Eye Liner(1.2ml),4.4/5,1465ratings&37reviews,₹599,₹479,20% Off,None,In Stock
Lakme,Lakme Vitamin C Superglow Concealer with 1 % Vit C - Ivory(5.4ml),4.4/5,926ratings&177reviews,₹300,₹279,7% Off,None,In Stock
Lakme,Lakme Retinol Advanced Renewal Night Gel Creme Pro-Retinol Peptide Complex(50 g),4.3/5,1771ratings&42reviews,₹1099,₹989,10% Off,None,In Stock
Lakme,Lakme 9 To 5 Primer + Gloss Nail Color - Smokey Crimson(6ml),4.4/5,28709ratings&2527reviews,₹240,N/A,No Discount,None,In Stock
Lakme,Lakme 9 To 5 Eyeconic Volume Mascara Black(8.5ml),4.3/5,6981ratings&227reviews,₹450,₹315,30% Off,None,In Stock
Lakme,"Lakme 9 To 5 Unreal Dual Cover Pressed Powder, 2 In 1 Compact + Foundation, 10 Ivory(9g)",4.2/5,1992ratings&68reviews,₹699,₹489,30% Off,None,In Stock
Lakme,Lakme Micellar Water Biphasic Make Up Remover(200ml),4.4/5,1231ratings&153reviews,₹550,₹303,45% Off,None,In Stock
Lakme,Lakme Ultimate Glam 4 In 1 Lip Stack - Nice Nudes(4ml),4.4/5,872ratings&259reviews,₹499,₹424,15% Off,None,In Stock
Lakme,"Lakme Absolute Gel Stylist Nail Color, Top Coat(12ml)",4.4/5,9639ratings&1053reviews,₹325,N/A,No Discount,None,In Stock
Lakme,"Lakme 9 To 5 Powerplay Mousse Foundation Mini, 01 Rose Ivory(9g)",4.2/5,15434ratings&1047reviews,₹230,₹150,35% Off,None,In Stock
Lakme,Lakme Facelift MultiSlayer Contour Stick - Neutral Medium(11g),4.5/5,243ratings&42reviews,₹899,₹719,20% Off,None,In Stock
Lakme,Lakme Gentle & Soft Deep Pore Cleanser With Avocado Soft And Glowing Skin(120ml),4.4/5,12546ratings&830reviews,₹299,₹269,10% Off,None,In Stock
Lakme,Lakme Ultimate Glam Chrome Nail Paint - CH7 Pink(6ml),4.3/5,1123ratings&51reviews,₹199,₹189,5% Off,None,In Stock
Lakme,Lakme Absolute Made To Last Setting Spray(60ml),4.4/5,2704ratings&69reviews,₹575,₹431,25% Off,None,In Stock
Lakme,Lakme Hyaluronic Dewy Gel Creme With Hyaluronic Acid(50gm),4.5/5,5604ratings&372reviews,₹849,₹764,10% Off,None,In Stock
Lakme,Lakme Rouge Bloom Eyeshadow Pro-Palette(27g),4.8/5,131ratings&94reviews,₹1799,N/A,No Discount,None,In Stock
Lakme,Lakme Lip Love Cherry Lip Balm 22Hr Moisturization Lip Balm with SPF 15(4.5g),4.4/5,46519ratings&4762reviews,₹249,₹224,10% Off,None,In Stock
Lakme,Lakme Absolute Beyond Matte Lipstick - 301 Brown Beauty(3.4 g),4.3/5,745ratings&24reviews,₹825,₹660,20% Off,None,In Stock
Lakme,Lakme Eyeconic Power Pack Combo(3 pcs),4.4/5,116869ratings&5673reviews,₹1169,₹760,35% Off,None,In Stock
Lakme,"Lakme Glitterati Lip Glaze, High Shine Lip Plumper Lip Gloss - Caramel Drizzle(5ml)",4.6/5,367ratings&198reviews,₹899,₹809,10% Off,None,In Stock
Lakme,"Lakme Forever Matte Foundation For Superior Coverage, Vit E, Lightweight & Water-Resist Marble(27ml)",4.3/5,11757ratings&1037reviews,₹209,₹199,5% Off,None,In Stock
Lakme,Lakme Vitamin C Superglow Skin Perfecting Tint with 3% Vit C - Cool Ivory(25ml),4.5/5,1110ratings&333reviews,₹399,₹371,7% Off,None,In Stock
Lakme,Lakme Retinol Advanced Renewal Serum 0.1% Retinol + 5% Peptide Complex(30ml),4.4/5,3100ratings&817reviews,₹999,₹899,10% Off,None,In Stock
Lakme,Lakme 9 To 5 Primer + Shine Lipstick - Blush Mauve(3.6gm),4.2/5,1532ratings&59reviews,₹550,₹413,25% Off,None,In Stock
Lakme,Lakme Lip Love & Cheek Tint - Downtown Nude(1.8 g),4/5,1538ratings&76reviews,₹349,₹314,10% Off,None,In Stock
Lakme,Lakme Vitamin C Brillance Serum With 10% Vit C Complex(30ml),4.6/5,520ratings&165reviews,₹799,₹719,10% Off,None,In Stock
Lakme,Lakme Absolute Spotlight Eye Shadow Palette Smokin Glam(12g),4.3/5,8333ratings&465reviews,₹1199,₹839,30% Off,None,In Stock
Lakme,Lakme Facelift Foundation Stick - Warm Creme(11 g),4.4/5,278ratings&93reviews,₹899,₹719,20% Off,None,In Stock
Lakme,"Lakme Blush & Glow Hydrating Strawberry Facewash, with Vitamin C Serum(100g)",4.4/5,18755ratings&1156reviews,₹269,₹242,10% Off,None,In Stock
Lakme,Lakme Youth Infinity Day + Night Cream Combo,4.3/5,5216ratings&158reviews,₹2098,₹1783,15% Off,None,In Stock
Lakme,Lakme Ultimate Glam Eyeshadow - Sunkissed(11.7g),4.1/5,405ratings&10reviews,₹425,₹383,10% Off,None,In Stock
Lakme,"Lakme Sunscreen Gel SPF 50 PA+++Niacinamide, Water Light, For Normal To Oily Skin,No White Cast(100g)",4.2/5,14368ratings&1594reviews,₹599,₹539,10% Off,None,In Stock
Lakme,Lakme Face It Blush - Natural Rose(4 g),4.3/5,1371ratings&58reviews,₹250,₹213,15% Off,None,In Stock
Lakme,Lakme Absolute Pore Fix Toner to Remove Impurities Tighten Pores and Refresh Skin(60ml),4.4/5,6130ratings&532reviews,₹325,₹293,10% Off,None,In Stock
Lakme,Lakme Sun Expert SPF 50 PA++++ 1% Hyaluronic Gel Sunscreen(56 g),4.3/5,960ratings&204reviews,₹499,₹424,15% Off,None,In Stock
Lakme,Lakme Absolute Skin Dew Satin Lipstick - 102 Nude Rose(3.4ml),4.2/5,2224ratings&200reviews,₹700,₹525,25% Off,None,In Stock
Lakme,Lakme Vitamin C Superglow Skin Perfecting Primer with 1 % Vit C(30ml),4.6/5,620ratings&178reviews,₹399,₹371,7% Off,None,In Stock
Lakme,Lakme CC Tinted Serum with 2% Hyaluronic Acid - Naturelle(30ml),4.5/5,293ratings&119reviews,₹699,₹629,10% Off,None,In Stock
Lakme,Lakme Eyeconic Collection - Eye Regime Kit(13.35 g),4.3/5,567ratings&18reviews,₹950,₹618,35% Off,None,In Stock
Lakme,"Lakme Unreal 3D Slim Bullet Lipstick, Matte Finish, Maroon Magic(3.6g)",4.2/5,4169ratings&307reviews,₹899,₹674,25% Off,None,In Stock
Lakme,Lakme Ultimate Glam Satin Matte Lipstick - Purple Sparkle(4.3g),4.4/5,37ratings&3reviews,₹350,N/A,No Discount,None,In Stock
Lakme,Lakme Sun Expert SPF 30 PA++ Ultra Matte Sunscreen with Vitamin B3(50ml),4.3/5,8195ratings&484reviews,₹299,₹269,10% Off,None,In Stock
Lakme,Lakme Absolute Loose Finishing Powder SPF 15- 24-Beige(8g),4.2/5,595ratings&6reviews,₹725,₹580,20% Off,None,In Stock
Lakme,Lakme 9 to 5 Vitamin C+ Day Cream with Vitamin C E & Shea Butter(50gm),4.3/5,6012ratings&251reviews,₹449,₹404,10% Off,None,In Stock
Lakme,Lakme Skin Solutions Sheet Mask With Pro Retinol C Complex - Anti-Aging(25ml),4.4/5,1459ratings&25reviews,₹150,₹101,33% Off,None,In Stock
Lakme,"Lakme Ultimate Glam Lip Liner, Spice Note(0.78gm)",4.2/5,2792ratings&85reviews,₹270,₹216,20% Off,None,In Stock
Lakme,Lakme Absolute Blur Perfect Mini Makeup Primer Combo(2 pcs),4.3/5,44838ratings&2453reviews,₹700,₹525,25% Off,None,In Stock
Lakme,Lakme Ultimate Glam Highlighter - Sun Kissed(4g),4.2/5,7120ratings&639reviews,₹500,₹425,15% Off,None,In Stock
Lakme,Lakme Glitterati Collection Shine Eyeliner - Daring Blue(4.5ml),4.3/5,772ratings&28reviews,₹699,₹489,30% Off,None,In Stock
Lakme,Lakme Perfect Radiance Brightening Face Wash(100g),4.3/5,11910ratings&742reviews,₹295,₹251,15% Off,None,In Stock
Lakme,Lakme Invisible Finish Full Coverage Liquid Foundation SPF 8 - Shade 01(25ml),4.4/5,5008ratings&656reviews,₹399,₹379,5% Off,None,In Stock
Lakme,Lakme Facelift Brow Sculpt Palette(4.5 g),4.2/5,66ratings&7reviews,₹750,₹563,25% Off,None,In Stock
Lakme,Lakme Absolute Argan Oil Radiance Overnight Oil In Serum with Moroccan Argan Oil(15ml),4.5/5,4166ratings&1432reviews,₹875,₹831,5% Off,None,In Stock
Lakme,Lakme Xtraordin - Airy Lip Mousse - Chocolate Temptation(1.8g),4.9/5,125ratings&120reviews,₹499,₹449,10% Off,None,In Stock
Lakme,Lakme Absolute Argan Oil Radiance Overnight Oil-In-Creme with Moroccan Argan Oil SPF 30 PA++(50gm),4.4/5,2849ratings&232reviews,₹899,₹854,5% Off,None,In Stock
Lakme,Lakme Vitamin C Superglow Skin Perfecting Compact with 1 % Vit C - Ivory(8gm),4.5/5,613ratings&154reviews,₹350,₹326,7% Off,None,In Stock
Lakme,Lakme Forever Matte Nude Dream + Nude Twist Liquid Lip Color Dream Combo,4.5/5,31158ratings&2997reviews,₹858,₹601,30% Off,None,In Stock
Lakme,Lakme 9 To 5 Primer + Matte Perfect Cover Foundation C100 Cool Ivory & Ivory Cream Compact Combo(2 pcs),4.3/5,95729ratings&5744reviews,₹1348,₹809,40% Off,None,In Stock
Lakme,Lakme Showstopper Collection Rouge Bloom Powder Blush - Pink Blossom(12g),4.8/5,114ratings&85reviews,₹899,N/A,No Discount,None,In Stock
Lakme,Lakme Lumi Lit Lotion Body Highlighter & Strobe Cream With Niacinamide & Hyaluronic Acid - Gold(100ml),4.8/5,303ratings&209reviews,₹549,₹494,10% Off,None,In Stock
Lakme,Lakme Black EyeBrow Pencil(1.2g),4.3/5,7739ratings&464reviews,₹99,₹94,5% Off,None,In Stock
Lakme,"Lakme Peach Milk Vit E Gel Moisturizer, Lightweight Gel to Hydrate Skin | With Vitamin E(200g)",4.6/5,247ratings&86reviews,₹535,₹428,20% Off,None,In Stock
Lakme,Lakme Sun Expert Invisible SPF 50 PA++++ Sunscreen Stick(18 g),4.4/5,425ratings&71reviews,₹899,₹764,15% Off,None,In Stock
Lakme,Lakme 9 to 5 Powerplay Velvet Creme Blush - Soft Coral(9 g),4.4/5,256ratings&19reviews,₹599,₹419,30% Off,None,In Stock
Lakme,Lakme 9 To 5 Matte To Glass Liquid Lip - Fuchsia Pink(7.6ml),3.9/5,864ratings&20reviews,₹650,₹520,20% Off,None,In Stock
Lakme,Lakme Peach Milk Ultra Light Gel Moisturizer with Vitamin E & Peach Milk Extract 24HR Moisture Lock(100g),4.4/5,7649ratings&541reviews,₹260,N/A,No Discount,None,In Stock
Lakme,Lakme 9to5 Powerplay Insta-Manicure Nail Enamel - Lilac Haze(6ml),4.6/5,79ratings&6reviews,₹250,₹238,5% Off,None,In Stock
Lakme,Lakme Absolute Perfect Radiance Skin Brightening Light Creme(50gm),4.3/5,1118ratings&119reviews,₹525,₹473,10% Off,None,In Stock
Lakme,Lakme No Makeup Must Haves Combo(3 pcs),4.4/5,105454ratings&5735reviews,₹1073,₹1000,7% Off,None,In Stock
Lakme,"Lakme Vitamin C Brilliance Night Cream With Vitamin C, Healthy, Glowing Skin(50gm)",4.3/5,4554ratings&173reviews,₹435,₹392,10% Off,None,In Stock
Lakme,Lakme CC Tinted Serum with 2% Hyaluronic Acid - Naturelle(30ml),4.5/5,293ratings&119reviews,₹699,₹629,10% Off,None,In Stock
Lakme,Lakme Eyeconic Insta Cool Deep Black Kajal Cooling Kohl with Cucumber(0.35gm),4.4/5,6300ratings&303reviews,₹275,₹220,20% Off,None,In Stock
Lakme,Lakme Hyaluronic Dewy Overnight Gel with Hyaluronic Acid(50gm),4.5/5,1814ratings&165reviews,₹849,₹764,10% Off,None,In Stock
Lakme,Lakme Facelift MultiSlayer Blush Stick - Sweet Cheeks(13 g),4.4/5,283ratings&59reviews,₹899,₹719,20% Off,None,In Stock
Lakme,Lakme Youth Infinity Serum & Day Cream Combo,4.3/5,3733ratings&134reviews,₹1498,₹1303,13% Off,None,In Stock
Lakme,"Lakme Xtraordin-Airy One-And-Done Lip, Eye & Cheek Tint - Toffee Touch(3ml)",4.5/5,418ratings&172reviews,₹699,₹559,20% Off,None,In Stock
Lakme,Lakme Absolute Argan Oil Radiance Oil-In-Gel Face Cream(50gm),4.4/5,1153ratings&93reviews,₹899,₹854,5% Off,None,In Stock
Lakme,Lakme Lumi Smooth AHA+BHA+PHA+B3 cream(50 g),4.6/5,494ratings&187reviews,₹375,₹338,10% Off,None,In Stock
Lakme,Lakme 8% AHA-BHA-PHA+ Complex Lumi Smooth Serum For Luminous Skin 1.5% Salicylic Acid & Lactic Acid(30ml),4.4/5,1060ratings&109reviews,₹525,₹473,10% Off,None,In Stock
Lakme,Lakme Micellar Water For Make-Up Removal(100ml),4.4/5,1209ratings&164reviews,₹230,₹207,10% Off,None,In Stock
Lakme,Lakme Peach Milk Intense Moisturizer Lotion(60ml),4.5/5,1092ratings&96reviews,₹99,N/A,No Discount,None,In Stock
Lakme,Lakme Showstopper Collection Rouge Bloom Setting Powder - Neutral Nude(12g),4.8/5,100ratings&60reviews,₹899,N/A,No Discount,None,In Stock
Lakme,Lakme Dual Sharpener,4.5/5,8923ratings&975reviews,₹75,N/A,No Discount,None,In Stock
Lakme,"Lakme Unreal Cover Creme Concealer Lightweight & Hydrating,Beige(3.9g)",4.2/5,750ratings&21reviews,₹625,₹469,25% Off,None,In Stock
Lakme,Lakme Glitterati Collection Nail Polish - Lavender Glam(6ml),4.1/5,883ratings&28reviews,₹245,N/A,No Discount,None,In Stock
Lakme,Lakme 9 To 5 Primer + Matte Mini Foundation - Warm Creme(15ml),4.3/5,1468ratings&41reviews,₹299,₹239,20% Off,None,In Stock
Lakme,Lakme Absolute Explore Eye Pencil - Mysterious Black(1.2 g),4.4/5,1025ratings&75reviews,₹750,₹638,15% Off,None,In Stock
Lakme,Lakme Glycolic Illuminate Day Cream With Glycolic Acid For Radiant & Even Tone Skin(50 g),4.2/5,360ratings&131reviews,₹749,₹674,10% Off,None,In Stock
Lakme,"Lakme Blush & Glow Hydrating Strawberry Facewash, with Vitamin C Serum(150g)",4.5/5,9719ratings&555reviews,₹490,₹368,25% Off,None,In Stock
Lakme,Lakme 9 to 5 Vitamin C 100% Soap Free Face Wash with Lemon Extract and Gentle Exfoliating Beads(100 g),4.3/5,3080ratings&122reviews,₹269,₹242,10% Off,None,In Stock
Lakme,Lakme 9to5 Natural Aloe Cleansing Wipes(25N),4.4/5,2742ratings&87reviews,₹150,₹143,5% Off,None,In Stock
Lakme,Lakme Sun Expert SPF50 PA+++ Face Primer + Sunscreen(50 g),4.4/5,234ratings&60reviews,₹649,₹552,15% Off,None,In Stock
Lakme,Lakme Absolute 10% Hyaluronic Acid-Pentavitin Complex Face Serum For Hydration & Barrier Repair(30ml),4.5/5,1864ratings&550reviews,₹799,₹719,10% Off,None,In Stock
Lakme,Lakme Hydra Pro (Day + Night Cream) Combo,4.5/5,6566ratings&489reviews,₹1698,₹1443,15% Off,None,In Stock
Lakme,Lakme Absolute Perfect Radiance Serum & Day Creme Combo,4.3/5,47544ratings&1918reviews,₹700,₹609,13% Off,None,In Stock
Lakme,Lakme Absolute Explore Eye Paint - Dreamy Rose(3g),4.3/5,627ratings&32reviews,₹550,₹385,30% Off,None,In Stock
Lakme,Lakme Blush & Glow Strawberry Gel Face Wash 100% Real Strawberry Extract(50g),4.5/5,387ratings&14reviews,₹130,N/A,No Discount,None,In Stock
Lakme,Lakme Glitterati Collection Shine Lipstick - Coffee Quen(3.4 g),4.1/5,692ratings&32reviews,₹799,₹679,15% Off,None,In Stock
Lakme,Lakme Bold Eyes Combo,4.3/5,65099ratings&6585reviews,₹1149,₹769,33% Off,None,In Stock
Lakme,Lakme Sun Expert SPF 25 PA++ Ultra Matte Lotion Sunscreen(100ml),4.4/5,4654ratings&265reviews,₹430,₹387,10% Off,None,In Stock
Lakme,Lakme Glycolic Illuminate Serum With 1% Glycolic Acid Reduces Dullness & Improves Texture(30ml),4.5/5,444ratings&156reviews,₹749,₹674,10% Off,None,In Stock
Lakme,Lakme Insta Eyeliner Combo (Pack of 2),4.3/5,86256ratings&7987reviews,₹380,₹342,10% Off,None,In Stock
Lakme,Lakme Absolute Perfect Radiance Skin Brightening Day Creme + Night Creme Combo(2 pcs),4.3/5,53337ratings&2363reviews,₹974,₹828,15% Off,None,In Stock
Lakme,Lakme Absolute Makeup Master Tools - Dual Ended Blush And Contour Brush(1 g),4.3/5,203ratings&11reviews,₹649,₹519,20% Off,None,In Stock
Lakme,Lakme Absolute Made To Last Setting Spray & Blur Perfect Makeup Primer Combo(2 pcs),4.4/5,32149ratings&2521reviews,₹1474,₹958,35% Off,None,In Stock
Lakme,Lakme Absolute Precision Eye Artist Eyebrow Pencil - Dark Brown(0.35g),4.3/5,565ratings&76reviews,₹850,₹638,25% Off,None,In Stock
Lakme,Lakme Primer + Matte Face Base Medium Combo(3 pcs),4.3/5,97338ratings&5799reviews,₹1923,₹1154,40% Off,None,In Stock
Lakme,Lakme Glycolic Illuminate Night Cream With Glycolic Acid & 1% Niacinamide For Skin Barrier Repair(50 g),4.6/5,261ratings&106reviews,₹775,₹698,10% Off,None,In Stock
Lakme,Lakme Xtraordin-Airy 2 In 1 Compact + Mattereal Mousse Foundation Combo,4.4/5,76124ratings&6779reviews,₹1974,₹1184,40% Off,None,In Stock
Lakme,Lakme Lumi Cream & Absolute Radiance Day Cream Combo(2pcs),4.3/5,98706ratings&4572reviews,₹724,₹630,13% Off,None,In Stock
Lakme,Lakme 9to5 Double Duty Moisturiser + Primer(30g),4.9/5,73ratings&64reviews,₹650,₹488,25% Off,None,In Stock
Lakme,Lakme Blush & Glow Strawberry Creme Face Wash With Strawberry Extract(100g),4.4/5,4525ratings&476reviews,₹260,₹234,10% Off,None,In Stock
Lakme,Lakme Lumi Moisturizer + 9 to 5 CC Cream Beige Combo,4.4/5,49835ratings&2958reviews,₹948,₹806,15% Off,None,In Stock
Lakme,Lakme 9 to 5 Powerplay Velvet Creme Highlighter - Sultry Gold(9 g),4.3/5,195ratings&8reviews,₹625,₹469,25% Off,None,In Stock
Lakme,Lakme Insta Eyeliner Combo - Black and Blue,4.3/5,86271ratings&7994reviews,₹370,₹333,10% Off,None,In Stock
Lakme,Lakme Vitamin C Morning Regime Combo,4.3/5,21727ratings&1068reviews,₹1866,₹1586,15% Off,None,In Stock
Lakme,Lakme 9 to 5 Naturale Day Face Cream(50gm),4.4/5,2677ratings&202reviews,₹375,₹356,5% Off,None,In Stock
Lakme,Lakme Absolute Instant Airbrush Concealer Pen - Cinmon(1.8 g),4.1/5,1014ratings&27reviews,₹699,₹489,30% Off,None,In Stock
Lakme,Lakme 6% Vit B3 E F & Pro-Ceramides Dew Drama Serum for Improved Skin Barrier & Dewy Radiant Skin(30ml),4.2/5,679ratings&27reviews,₹525,₹473,10% Off,None,In Stock
Lakme,Lakme Face It Highlighter - Rosegold(4 g),4.1/5,341ratings&16reviews,₹299,₹254,15% Off,None,In Stock
Lakme,Lakme Dew Drama Gel Creme With With Vit E + Vit B + Vit F & Pro-Ceramides For Improved Skin Barrier(50 g),4.6/5,258ratings&119reviews,₹349,₹314,10% Off,None,In Stock
Lakme,Lakme Absolute Makeup Master Tools - Dual Ended Eyeshadow Brush(1 g),4.3/5,115ratings&1reviews,₹699,₹559,20% Off,None,In Stock
