Product Brand,Product Name,Product Rating,Product Rating & Review Count,Product Original Price,Product Offer Price,Product Discount,Product Highlight,Product Stock Status
Lakme,Lakme Absolute Makeup Master Tools - Dual Ended Fondation & Powder Brush(1pcs),4.4/5,136ratings&10reviews,₹799,₹639,20% Off,None,In Stock
Lakme,Lakme Lash Boost Extreme Mascara Black(10ml),4.4/5,84ratings&2reviews,₹849,₹637,25% Off,None,In Stock
Lakme,"Lakme Beyond Matte Liquid Lip Color, Pink Footprint(2.4ml)",4.4/5,12159ratings&1069reviews,₹450,₹360,20% Off,None,In Stock
Lakme,Lakme Absolute Perfect Radiance with Niacinamide CSMS Combo,4.3/5,95675ratings&5350reviews,₹1824,₹1587,13% Off,None,In Stock
Lakme,Lakme Absolute Skin Dew Face Primer(28 g),4.2/5,363ratings&7reviews,₹799,₹495,38% Off,None,In Stock
Lakme,Lakme Duo Lip Combo(2 pcs),4.2/5,73069ratings&3406reviews,₹1300,₹780,40% Off,None,In Stock
Lakme,Lakme Hydrating & Exfoliating Lip Scrub with Hyaluronic Acid for Soft Luscious Lips(15 g),4.3/5,358ratings&11reviews,₹349,₹314,10% Off,None,In Stock
Lakme,Lakme Fashionista's Fix Collection(5 pcs),4.3/5,157251ratings&13708reviews,₹2445,₹1764,28% Off,None,In Stock
Lakme,Lakme Vit C + Serum + Spf 50 Sunscreen Combo(2 pcs),4.3/5,46339ratings&2361reviews,₹1274,₹1147,10% Off,None,In Stock
Lakme,Lakme 9 to 5 Eye Color Quartet Eye Shadow - Desert Rose(7gm),4.3/5,1400ratings&203reviews,₹675,₹452,33% Off,None,In Stock
Lakme,Lakme 9To5 Vitamin C AM PM Routine Combo(50gm),4.3/5,28012ratings&2129reviews,₹1533,₹1380,10% Off,None,In Stock
Lakme,Lakme Absolute Makeup Master Tools - Dual Ended Sided Beauty Blender(1 g),4.3/5,272ratings&7reviews,₹399,₹319,20% Off,None,In Stock
Lakme,Lakme CC Tinted Serum with 2% Hyaluronic Acid - Crème(30ml),4.5/5,293ratings&119reviews,₹699,₹629,10% Off,None,In Stock
Lakme,Lakme Eye Catchy Combo(3 pcs),4.3/5,86245ratings&7984reviews,₹550,₹523,5% Off,None,In Stock
Lakme,Lakme CC Tinted Serum with 2% Hyaluronic Acid - Latte(30ml),4.5/5,293ratings&119reviews,₹699,₹629,10% Off,None,In Stock
Lakme,Lakme Sun Expert SPF 50 PA+++ Ultra Matte Lotion Sunscreen - Pack Of 2(2 pcs),4.3/5,50974ratings&2777reviews,₹1250,₹1126,10% Off,None,In Stock
Lakme,Lakme Glycolic Illuminate Facewash With Glycolic Acid For Gentle Exfoliation & Illuminated Skin(100ml),4.5/5,400ratings&113reviews,₹329,₹280,15% Off,None,In Stock
Lakme,Lakme Sun Expert De Tan Scrub(50gm),4.4/5,2742ratings&154reviews,₹175,N/A,No Discount,None,In Stock
Lakme,Lakme Lumi-Smooth AHA+ Facewash with 2% Salicylic & Lactic Acid for Glowing Skin(100 g),4.6/5,232ratings&104reviews,₹249,₹224,10% Off,None,In Stock
Lakme,Lakme Hyaluronic Dewy Micro Essence with 4% Hyaluronic Acid(100ml),4.8/5,142ratings&106reviews,₹699,₹629,10% Off,None,In Stock
Lakme,Lakme Absolute Perfect Radiance AM PM Routine(3 pcs),4.3/5,59612ratings&3311reviews,₹1623,₹1461,10% Off,None,In Stock
Lakme,Lakme Primer & Matte Festive Lips Combo(2 pcs),4.2/5,73067ratings&3405reviews,₹1198,₹719,40% Off,None,In Stock
Lakme,Lakme Unreal Gel Stylist Nail Care Oil(12ml),4.4/5,284ratings&15reviews,₹399,₹319,20% Off,None,In Stock
Lakme,Lakme Facewash Strawberry + Kiwi + Lemon Combo(3 pcs),4.4/5,18758ratings&1159reviews,₹797,₹677,15% Off,None,In Stock
Lakme,Lakme 9 To 5 Primer + Matte Powder Compact Silky Golden & W120 Warm Creme Foundation Combo(2 pcs),4.3/5,95728ratings&5744reviews,₹1348,₹809,40% Off,None,In Stock
Lakme,Lakme Blush & Glow Brightening Face Wash Lemon With Vitamin C Serum(50g),4.4/5,4374ratings&265reviews,₹130,N/A,No Discount,None,In Stock
Lakme,Lakme Absolute Perfect Radiance Facewash & Serum Combo,4.3/5,16877ratings&889reviews,₹500,₹475,5% Off,None,In Stock
Lakme,Lakme Primer + Matte Face Base Light Combo(3 pcs),4.3/5,98550ratings&5807reviews,₹1923,₹1154,40% Off,None,In Stock
Lakme,Lakme Absolute Explore Eye Shadow Stick - Blue Orchid(1.4g),4.3/5,347ratings&14reviews,₹750,₹600,20% Off,None,In Stock
Lakme,Lakme Absolute Blur Perfect Makeup Primer + Insta Liner Eye Liner - Black,4.4/5,86933ratings&6903reviews,₹1089,₹708,35% Off,None,In Stock
Lakme,Lakme Sindoor Combo (Pack of 2),4.4/5,6828ratings&310reviews,₹350,₹315,10% Off,None,In Stock
Lakme,Lakme Sun Expert Tinted PA SPF50++ Spray(50ml),4/5,990ratings&35reviews,₹575,₹518,10% Off,None,In Stock
Lakme,Lakme Color Crush - Pack of 3(3 pcs),4.3/5,36569ratings&3587reviews,₹567,₹482,15% Off,None,In Stock
Lakme,Lakme Vitamin C Routine Starter Kit(3 pcs),4.3/5,20398ratings&836reviews,₹1367,₹1230,10% Off,None,In Stock
Lakme,Lakme Absolute Perfect Radiance Facewash & Day Cream Combo,4.3/5,54364ratings&2501reviews,₹550,₹504,8% Off,None,In Stock
Lakme,Lakme Absolute Foundation & Creme Concealer Combo - Light(2 pcs),4.4/5,51770ratings&4714reviews,₹1624,₹1068,34% Off,None,In Stock
Lakme,Lakme Blush & Glow Kiwi Gel Face Wash 100% Real Kiwi Extract(50g),4.4/5,4662ratings&336reviews,₹125,N/A,No Discount,None,In Stock
Lakme,Lakme Lip Mousse Mini Bestseller Trio(2pcs),4.9/5,80ratings&78reviews,₹1497,₹1347,10% Off,None,In Stock
Lakme,Lakme Retinol Advanced Renewal Under Eye Serum Creme(15g),5/5,1ratings,₹899,₹809,10% Off,None,In Stock
Lakme,Lakme Absolute Sheer Cheek Mousse Blush - Pink Rose(6ml),4/5,163ratings&14reviews,₹650,₹488,25% Off,None,In Stock
Lakme,Lakme Eyeconic Brow Boss - Brown(5 g),4.4/5,27ratings,₹650,₹520,20% Off,None,In Stock
Lakme,Lakme Eyeconic Combo (Liner Pen + Kajal + Mascara)(4 Pcs),4.4/5,60135ratings&2760reviews,₹1420,₹870,39% Off,None,In Stock
Lakme,Lakme UltimateGlam Volumizing Mascara - Black(10ml),4.1/5,22ratings,₹350,₹315,10% Off,None,In Stock
Lakme,Lakme Dew Drama Facewash with Pro-Ceramides & 6% Vitamin E + B3 + F Complex for Glowing Skin(100 g),4.7/5,195ratings&106reviews,₹249,₹224,10% Off,None,In Stock
Lakme,Lakme Wink & Win Combo (Eyeliner + Mascara),4.4/5,84564ratings&4866reviews,₹749,₹487,35% Off,None,In Stock
Lakme,Lakme Vitamin C Combo - 10% Vitamin C Serum + Facewash + Day Cream,4.3/5,9384ratings&484reviews,₹1117,₹972,13% Off,None,In Stock
Lakme,Lakme Ace Your Base Combo(2 pcs),4.4/5,81075ratings&7161reviews,₹1898,₹1139,40% Off,None,In Stock
Lakme,Lakme Lip & Cheek Soft Pinks Combo(2 pcs),4.2/5,52626ratings&8427reviews,₹1450,₹870,40% Off,None,In Stock
Lakme,Lakme Turn Heads Collection(3 pcs),4.4/5,95962ratings&4830reviews,₹1248,₹860,31% Off,None,In Stock
Lakme,Lakme 9To5 Vitamin C AM Routine Combo(50gm),4.3/5,23443ratings&1947reviews,₹1098,₹988,10% Off,None,In Stock
Lakme,Lakme 9 To 5 Eyeconic Cream Powder Eyeshadow Stack - Pink Beauty(7g),3.8/5,30ratings&3reviews,₹699,₹594,15% Off,None,In Stock
Lakme,Lakme Peach Milk Hydration Combo(2 pcs),4.4/5,18587ratings&1557reviews,₹1019,₹865,15% Off,None,In Stock
Lakme,Lakme CC Tinted Serum with 2% Hyaluronic Acid - Dolce(30ml),4.5/5,293ratings&119reviews,₹699,₹629,10% Off,None,In Stock
Lakme,Lakme Get Set Shimmer Nail Polish Collection(2 pcs),4.3/5,36569ratings&3588reviews,₹378,N/A,No Discount,None,In Stock
Lakme,Lakme Eyeconic Classic Brown Kajal - Pack of 2(2 pcs),4.4/5,46750ratings&4804reviews,₹650,₹488,25% Off,None,In Stock
Lakme,Lakme Perfect Face Combo (Eyeliner + Primer)(2 Pcs),4.4/5,94554ratings&4793reviews,₹649,₹489,25% Off,None,In Stock
Lakme,Lakmé Hyaluronic Dewy Facewash with 4D Hyaluronic Acid for Deep Hydration & Glowing Skin(100g),4.6/5,15ratings&1reviews,₹399,₹359,10% Off,None,In Stock
Lakme,Lakme 9 To 5 Vit C+ Under Eye Gel(15gm),4.3/5,221ratings&4reviews,₹549,₹494,10% Off,None,In Stock
Lakme,Lakme Vitamin C Serum & Day Creme Combo,4.3/5,6304ratings&362reviews,₹848,₹738,13% Off,None,In Stock
Lakme,Lakme Blush & Glow Brightening Face Wash with Vitamin C Serum and Lemon Fruit Extracts(150g),N/A,None,₹490,N/A,No Discount,None,In Stock
Lakme,Lakme Glitterati Marble Highlighter - Shimmer Rose(7g),3/5,2ratings,₹799,₹719,10% Off,None,In Stock
Lakme,Lakme Vitamin C 10% Serum + Nia-VIT C Sunscreen Combo,4.4/5,1625ratings&346reviews,₹898,₹754,16% Off,None,In Stock
Lakme,Lakme Insta Eyeliner Combo - Black and Green,4.3/5,86245ratings&7984reviews,₹370,₹333,10% Off,None,In Stock
Lakme,Lakme Pink Blossom Lipstick & Blush Combo(2 Pcs),4.6/5,132ratings&74reviews,₹1898,N/A,No Discount,None,In Stock
Lakme,Lakme Lumi Moisturizer + 9 to 5 CC Light Mousse Beige Combo,4.3/5,54840ratings&2411reviews,₹874,₹760,13% Off,None,In Stock
Lakme,Lakme Lumi-Smooth AHA+ Face Wash + Oil-Control Moisturizer Combo,4.6/5,726ratings&291reviews,₹624,₹562,10% Off,None,In Stock
Lakme,Lakme Eyeconic Curling Mascara - Black + Absolute Blur Perfect Makeup Primer Combo,4.4/5,57052ratings&4407reviews,₹1349,₹877,35% Off,None,In Stock
Lakme,Lakme Vit C Superglow Base Combo (Fixer + Primer)(2 Pcs),4.5/5,2015ratings&296reviews,₹724,₹652,10% Off,None,In Stock
Lakme,Lakme Dewy Skin Day & Night Kit(2 pcs),4.5/5,6560ratings&488reviews,₹1698,₹1528,10% Off,None,In Stock
Lakme,Lakme Absolute Matte Ultimate Lip Color with Argan Oil - 205 Orchid Pink(3.4g),4.4/5,15054ratings&1387reviews,₹800,N/A,No Discount,None,In Stock
Lakme,Lakme Lip Nude Favourites(2 pcs),4.2/5,62331ratings&8958reviews,₹1375,₹825,40% Off,None,In Stock
Lakme,Lakme Vit C Superglow Ivory Combo (Tint + Compact)(2 Pcs),4.5/5,875ratings&235reviews,₹749,₹674,10% Off,None,In Stock
Lakme,Lakme Unreal Cover Color Correctors - Purple(3.9g),4.2/5,31ratings&1reviews,₹550,₹440,20% Off,None,In Stock
Lakme,Lakme Scarlet Rose Ultimate Lipstick & Lip Liner Combo(2 Pcs),4.4/5,459ratings&92reviews,₹1269,₹1215,4% Off,None,In Stock
Lakme,Lakme 9 to 5 Vitamin C+ Scrub with Licorice Extract and Walnut Shell Powder Gentle Exfoliator(50 g),4.4/5,178ratings&8reviews,₹399,₹359,10% Off,None,In Stock
Lakme,Lakme Glycolic AM Routine Combo,4.3/5,1949ratings&380reviews,₹2326,₹1931,17% Off,None,In Stock
Lakme,Lakme Blush & Glow Refreshing Face Wash with Vitamin C Serum and Kiwi Fruit Extracts(150g),5/5,2ratings,₹490,N/A,No Discount,None,In Stock
Lakme,Lakme Mini Primer + Cocoa Sin Combo(2 pcs),4.3/5,38079ratings&1909reviews,₹1000,₹700,30% Off,None,In Stock
Lakme,Lakme 9to5 Matte Moist Clay Facewash(100 g),4.3/5,239ratings&12reviews,₹260,N/A,No Discount,None,In Stock
Lakme,Lakme Call Me Bae Liquid Lipstick & Blush Combo(2 Pcs),4.8/5,181ratings&133reviews,₹2098,N/A,No Discount,None,In Stock
Lakme,Lakme Glycolic Illuminate Serum & Day Cream Combo,4/5,337ratings&39reviews,₹1498,₹1273,15% Off,None,In Stock
Lakme,Lakme Lumi Strobe Cream Face & Body - Dewy Rose & Bronze,4.4/5,9339ratings&405reviews,₹1098,₹988,10% Off,None,In Stock
Lakme,Lakme Primer + Gloss Nail Polish Pastels Collection(2 pcs),4.4/5,28709ratings&2527reviews,₹465,₹395,15% Off,None,In Stock
Lakme,"Lakme Unreal 3D Lip Definer, Sepia(12g)",4.3/5,182ratings&11reviews,₹750,N/A,No Discount,None,In Stock
Lakme,Lakme Everyday Essentails Combo (Kajal + CC Cream)(2 Pcs),4.4/5,90985ratings&7579reviews,₹609,₹559,8% Off,None,In Stock
Lakme,Lakme Sun Expert SPF 50 PA++++ Sunscreen Stick & Nia-VIT C Sunscreen Combo,4.3/5,1758ratings&306reviews,₹1398,₹1118,20% Off,None,In Stock
Lakme,Lakme Vit C Superglow Concealer with Setting Spray Combo(2 Pcs),4.4/5,1935ratings&201reviews,₹625,₹563,10% Off,None,In Stock
Lakme,Lakme Nails - Pack of 3(3 pcs),4.4/5,28709ratings&2527reviews,₹720,₹612,15% Off,None,In Stock
Lakme,Lakme Superglow Prep Cover Set Combo(3 Pcs),4.5/5,2555ratings&379reviews,₹1024,₹952,7% Off,None,In Stock
Lakme,Lakme Vitamin C Brillance Serum & Vitamin C Facewash Combo,4.4/5,3372ratings&233reviews,₹668,₹621,7% Off,None,In Stock
Lakme,"Lakme Glitterati Lip Glaze, High Shine Lip Plumper Lip Gloss & Lip Liner Combo - Nudes(2 Pcs)",4.4/5,409ratings&59reviews,₹1169,₹1052,10% Off,None,In Stock
Lakme,Lakme Super Saver Daily Essentails Combo (Kajal + CC Cream)(3 Pcs),4.5/5,76536ratings&3578reviews,₹819,₹653,20% Off,None,In Stock
Lakme,Lakme Romance Ready Duo (Lipstick + Eyeliner)(2 Pcs),4.4/5,66661ratings&3441reviews,₹949,₹612,36% Off,None,In Stock
Lakme,Lakme Glitter Glaze Lip Gloss & Lip Liner Nude Combo(2 Pcs),4.4/5,419ratings&59reviews,₹1169,₹1025,12% Off,None,In Stock
Lakme,Lakme Glycolic Illuminate Regime Combo,4.1/5,458ratings&46reviews,₹1697,₹1425,16% Off,None,In Stock
Lakme,Lakme Vit C Superglow Compact with Setting Spray Combo(2 Pcs),4.5/5,1739ratings&195reviews,₹675,₹608,10% Off,None,In Stock
Lakme,Lakme Color Crush Nail Art - G12 + Nail Polish Remover Combo,4.4/5,59050ratings&4850reviews,₹288,₹268,7% Off,None,In Stock
Lakme,Lakme Lumi Strobe Cream Face & Body - Gold,4.3/5,3776ratings&223reviews,₹1198,₹1018,15% Off,None,In Stock
Lakme,Lakme Blooming Beauty Lipstick Combo(2 Pcs),4.6/5,162ratings&90reviews,₹2198,N/A,No Discount,None,In Stock
Lakme,Lakme CC Cream + Eyeliner Pen Tip Duo(2 Pcs),4.4/5,101191ratings&5685reviews,₹698,₹568,19% Off,None,In Stock
Lakme,Lakme Glitterati Face Palette - Day Queen(14g),3.3/5,3ratings,₹1199,₹1019,15% Off,None,In Stock
Lakme,Lakme Superglow Base Combo (Primer + Fixer)(2 Pcs),4.5/5,2015ratings&296reviews,₹724,₹673,7% Off,None,In Stock
Lakme,Lakme Glycolic Serum & Facewash Combo,4.3/5,234ratings&12reviews,₹948,₹853,10% Off,None,In Stock
Lakme,Lakme Eyeconic Brow Boss - Light Brown(5 g),4.5/5,6ratings,₹650,₹520,20% Off,None,In Stock
Lakme,Lakme Sun Expert SPF 50 PA++++ Sunscreen Stick & Hyaluronic Sunscreen Combo,4.4/5,1385ratings&275reviews,₹1398,₹1118,20% Off,None,In Stock
Lakme,Lakme Sweet Drizzle Lipstick Combo(2 Pcs),4.7/5,117ratings&57reviews,₹2098,₹2008,4% Off,None,In Stock
Lakme,Lakme Perfect Pujo Look Combo(3 Pcs),4.4/5,59093ratings&3025reviews,₹1499,₹997,33% Off,None,In Stock
Lakme,Lakme Tulip Spice Liquid Lipstick & Lip Liner Combo(2 Pcs),4.2/5,457ratings&35reviews,₹1469,₹1415,4% Off,None,In Stock
Lakme,Lakme Vit C Superglow Face Base Combo (Fixer + Tint)(2 Pcs),4.5/5,1926ratings&276reviews,₹724,₹652,10% Off,None,In Stock
Lakme,Lakme Lumi + Sun Protect Combo,4.3/5,55265ratings&2482reviews,₹1773,₹1472,17% Off,None,In Stock
Lakme,"Lakme Glitterati Lip Glaze, High Shine Lip Plumper Lip Gloss & Lip Liner Combo - Reds(2 Pcs)",4.2/5,483ratings&58reviews,₹1169,₹1052,10% Off,None,In Stock
Lakme,Lakme Absolute Gloss Artist Eye Liner - Black(2.5ml),4.4/5,973ratings&115reviews,₹750,₹525,30% Off,None,Out Of Stock
Lakme,Lakme Absolute Matte Melt Liquid Lip Color - Revenge Red(6ml),4.3/5,5287ratings&252reviews,₹700,₹525,25% Off,None,Out Of Stock
Lakme,Lakme Facelift MultiSlayer Highlighter Stick - Sunlit Sepia(13 g),4.3/5,147ratings&26reviews,₹899,₹719,20% Off,None,Out Of Stock
Lakme,Lakme Micellar Pure Facewash For Deep Pore Cleanse(50 g),4.3/5,1101ratings&151reviews,₹149,N/A,No Discount,None,Out Of Stock
Lakme,"Lakme Xtraordin-Airy Mattreal Mousse Concealer, Conceals Dark Circles, Even Skin Tone, Natural(9g)",4.3/5,1431ratings&91reviews,₹600,₹450,25% Off,None,Out Of Stock
Lakme,Lakme Prep Cover Set Combo with Setting Spray(3 pcs),4.4/5,79372ratings&5157reviews,₹1424,₹1068,25% Off,None,Out Of Stock
Lakme,Lakme Absolute 3D Eye Brow Definer - Graphite(1.19g),4.4/5,343ratings&21reviews,₹800,₹600,25% Off,None,Out Of Stock
Lakme,Lakme 9 To 5 Pure Rouge Blusher - Nude Flush(6g),4.3/5,5987ratings&693reviews,₹575,₹403,30% Off,None,Out Of Stock
Lakme,Lakme Glitterati Face Palette - Night Diva(14g),4.5/5,15ratings&2reviews,₹1199,₹1019,15% Off,None,Out Of Stock
Lakme,"Lakme Unreal 3D Lash Maximiser, Black(15ml)",4.1/5,590ratings&58reviews,₹800,₹560,30% Off,None,Out Of Stock
Lakme,Lakme Face It Loose Finishing Powder(15 g),4.3/5,988ratings&36reviews,₹285,₹257,10% Off,None,Out Of Stock
Lakme,Lakme Absolute Mousse Lip Duo(2 pcs),4.3/5,9699ratings&697reviews,₹1550,₹930,40% Off,None,Out Of Stock
Lakme,Lakme Absolute Explore Eye Shadow Palette - Desert Sunset(10g),4.1/5,165ratings&7reviews,₹995,₹697,30% Off,None,Out Of Stock
Lakme,Lakme 9 to 5 Naturale Aloe Aqua Hydrating Face Gel with 100% Natural Aloe Vera(50g),4.4/5,10152ratings&1117reviews,₹225,N/A,No Discount,None,Out Of Stock
Lakme,"Lakme Glitterati Liquid Highlighter For Dewy Makeup Look, Ivory(25g)",4.3/5,5875ratings&218reviews,₹650,₹520,20% Off,None,Out Of Stock
Lakme,Lakme Absolute Mousse Date Night Combo(2 pcs),4.3/5,9698ratings&696reviews,₹1799,₹1079,40% Off,None,Out Of Stock
Lakme,Lakme Absolute Kohl Ultimate Kajal - Black(1.2g),4.3/5,2712ratings&370reviews,₹825,₹536,35% Off,None,Out Of Stock
Lakme,Lakme Hydrating Lip Love Lip Mask with Hyaluronic Acid Shea Butter & Almond Oil(13 g),4.4/5,438ratings&28reviews,₹325,₹293,10% Off,None,Out Of Stock
Lakme,Lakme Micellar Pure Facewash + Bi-Phasic Remover Combo,4.4/5,1224ratings&146reviews,₹849,₹543,36% Off,None,Out Of Stock
Lakme,Lakme 9to5 Primer + Matte Liquid Lipstick - Minis - Bold Collection(8ml),4/5,960ratings&41reviews,₹999,₹749,25% Off,None,Out Of Stock
Lakme,Lakme Hydra Pro Hyaluronic Serum & Day Creme Combo,4.5/5,5166ratings&339reviews,₹1248,₹1086,13% Off,None,Out Of Stock
Lakme,Lakme Lip Love SPF 15 Gelato Lip Balm for Soft Lips - Berry Mint(4.5g),4.3/5,4888ratings&445reviews,₹199,N/A,No Discount,None,Out Of Stock
Lakme,Lakme Black Kajal Pencil Sharpenable Kajal Pencil for Bold Looking Eyes(2g),4.2/5,10147ratings&649reviews,₹85,N/A,No Discount,None,Out Of Stock
Lakme,Lakme Mini Primer + Crimson Sky Combo(2 pcs),4.3/5,38228ratings&1908reviews,₹1000,₹650,35% Off,None,Out Of Stock
Lakme,"Lakme Eyeconic Fine Tip Pen Eyeliner, Waterproof - Black(1ml)",4.4/5,6957ratings&728reviews,₹550,₹468,15% Off,None,Out Of Stock
Lakme,Lakme Blush & Glow Lemon Freshness Gel Face Wash(50g),4.4/5,725ratings&116reviews,₹125,N/A,No Discount,None,Out Of Stock
Lakme,Lakme Absolute Facelift Palette - Golden Hour(15 g),4.3/5,566ratings&15reviews,₹900,₹630,30% Off,None,Out Of Stock
Lakme,Lakme Absolute Skin Dew Serum Foundation - Cool Ivory(30 g),4/5,704ratings&41reviews,₹875,₹613,30% Off,None,Out Of Stock
Lakme,Lakme Glam Lips + Eyes Duo(2 Pcs),4.3/5,41443ratings&5040reviews,₹1599,₹1039,35% Off,None,Out Of Stock
Lakme,Lakme Eyeconic Liner Pen BLock Tip(1ml),4.1/5,831ratings&129reviews,₹550,₹468,15% Off,None,Out Of Stock
Lakme,Lakme Hyaluronic Acid Face serum & Sun Expert SPF PA ++++ 1% Hyaluronic Sunscreen,4.3/5,1380ratings&220reviews,₹898,₹754,16% Off,None,Out Of Stock
Lakme,Lakme Prime And Conceal(2 pcs),4.4/5,38997ratings&3195reviews,₹1598,₹1046,35% Off,None,Out Of Stock
Lakme,Lakme Flawless Base Combo(3 pcs),4.4/5,76807ratings&6789reviews,₹2673,₹1722,36% Off,None,Out Of Stock
Lakme,Lakme's Haute Nails Selection - Set Of 4(24ml),4.2/5,118ratings&3reviews,₹760,N/A,No Discount,None,Out Of Stock
Lakme,Lakme Micellar Pure Facewash + Makeup Remover Combo,4.4/5,1146ratings&157reviews,₹749,₹487,35% Off,None,Out Of Stock
Lakme,Lakme Prep Cover Set Multipurpose Combo(3 pcs),4.4/5,101089ratings&7148reviews,₹2024,₹1316,35% Off,None,Out Of Stock
Lakme,Lakme Absolute Skin Dew Serum Foundation + Setting Spray(2 pcs),4.3/5,3408ratings&110reviews,₹1450,₹1044,28% Off,None,Out Of Stock
