Product Brand,Product Name,Product Rating,Product Rating & Review Count,Product Original Price,Product Offer Price,Product Discount,Product Highlight,Product Stock Status
The Ordinary.,The Ordinary Niacinamide 10% + Zinc 1%(30ml),4.4/5,73496ratings&5498reviews,₹600,N/A,No Discount,None,In Stock
The Ordinary.,The Ordinary GF 15% Solution(30ml),4.9/5,7ratings&2reviews,₹1550,N/A,No Discount,None,In Stock
The Ordinary.,The Ordinary Glycolic Acid 7% Exfoliating Mini Toner(100ml),4.4/5,31051ratings&2750reviews,₹900,N/A,No Discount,None,In Stock
The Ordinary.,"The Ordinary Multi-Peptide Hair Serum For Denser, Thicker, Healthier Hair (All Hair Types)(60ml)",4.4/5,13742ratings&1414reviews,₹2150,N/A,No Discount,BESTSELLER,In Stock
The Ordinary.,The Ordinary AHA 30% + BHA 2% Peeling Solution(30ml),4.4/5,21214ratings&2112reviews,₹950,N/A,No Discount,BESTSELLER,In Stock
The Ordinary.,The Ordinary Mini Discovery Set(225ml),4.2/5,10ratings,₹2850,N/A,No Discount,None,In Stock
The Ordinary.,The Ordinary Caffeine Solution 5% + EGCG(30ml),4.3/5,7776ratings&738reviews,₹900,N/A,No Discount,None,In Stock
The Ordinary.,The Ordinary Saccharomyces Ferment 30% Milky Toner(100ml),4.9/5,19ratings&3reviews,₹1500,N/A,No Discount,None,In Stock
The Ordinary.,The Ordinary Multi-Peptide + Copper Peptides 1% Serum(30ml),4.5/5,910ratings&88reviews,₹2950,N/A,No Discount,BESTSELLER,In Stock
The Ordinary.,The Ordinary Salicylic Acid 0.5% Body Serum(240ml),4.7/5,10ratings&2reviews,₹1500,N/A,No Discount,None,In Stock
The Ordinary.,The Ordinary Glycolic Acid 7% Toning Solution(240ml),4.4/5,31051ratings&2750reviews,₹1275,N/A,No Discount,BESTSELLER,In Stock
The Ordinary.,The Ordinary Niacinamide 10% + Zinc 1%(30ml),4.4/5,73496ratings&5498reviews,₹600,N/A,No Discount,BESTSELLER,In Stock
The Ordinary.,The Ordinary Hyaluronic Acid 2% + B5(30ml),4.5/5,14885ratings&929reviews,₹1000,N/A,No Discount,BESTSELLER,In Stock
The Ordinary.,The Ordinary Retinol 0.5% In Squalane(30ml),4.4/5,10594ratings&735reviews,₹875,N/A,No Discount,BESTSELLER,In Stock
The Ordinary.,The Ordinary Salicylic Acid 2% Solution(30ml),4.4/5,18047ratings&1477reviews,₹600,N/A,No Discount,BESTSELLER,In Stock
The Ordinary.,The Ordinary Argireline Solution 10%(30ml),4.5/5,513ratings&62reviews,₹1000,N/A,No Discount,None,In Stock
The Ordinary.,The Ordinary Azelaic Acid Suspension 10%(30ml),4.3/5,3252ratings&318reviews,₹1150,N/A,No Discount,None,In Stock
The Ordinary.,The Ordinary Ascorbyl Glucoside Solution 12% (Vitamin C)(30ml),4.4/5,2897ratings&191reviews,₹1450,N/A,No Discount,None,In Stock
The Ordinary.,The Ordinary Alpha Arbutin 2% + HA Face Serum(30ml),4.7/5,39ratings&3reviews,₹1200,N/A,No Discount,None,In Stock
The Ordinary.,The Ordinary Soothing & Barrier Support Serum(30ml),4.4/5,1230ratings&172reviews,₹1850,N/A,No Discount,None,In Stock
The Ordinary.,The Ordinary Multi-Peptide Eye Serum(15ml),4.3/5,640ratings&40reviews,₹2600,N/A,No Discount,None,In Stock
The Ordinary.,The Ordinary Multi Peptide + HA Serum(30ml),4.5/5,2066ratings&106reviews,₹1700,N/A,No Discount,None,In Stock
The Ordinary.,The Ordinary Multi-Peptide Lash And Brow Serum(5ml),4.3/5,1460ratings&163reviews,₹1600,N/A,No Discount,None,In Stock
The Ordinary.,The Ordinary Natural Moisturizing Factors + HA(30ml),4.3/5,7938ratings&638reviews,₹700,N/A,No Discount,None,In Stock
The Ordinary.,The Ordinary Granactive Retinoid 2% Emulsion(30ml),4.5/5,1904ratings&133reviews,₹1200,N/A,No Discount,None,In Stock
The Ordinary.,The Ordinary Lactic Acid 10% + HA(30ml),4.3/5,2724ratings&173reviews,₹950,N/A,No Discount,None,In Stock
The Ordinary.,The Ordinary Squalane + Amino Acids Lip Balm(15ml),4.1/5,244ratings&61reviews,₹950,N/A,No Discount,None,In Stock
The Ordinary.,The Ordinary Vitamin C Suspension 23% + HA Spheres 2%(30ml),4.1/5,4036ratings&481reviews,₹900,N/A,No Discount,None,In Stock
The Ordinary.,The Ordinary Salicylic Acid 2% Masque(50ml),4.4/5,1161ratings&129reviews,₹1450,N/A,No Discount,None,In Stock
The Ordinary.,The Ordinary Natural Moisturizing Factors + Beta Glucan(100ml),4.4/5,533ratings&32reviews,₹1450,N/A,No Discount,None,In Stock
The Ordinary.,The Ordinary Squalane Cleanser(50ml),4.3/5,1868ratings&150reviews,₹1050,N/A,No Discount,None,In Stock
The Ordinary.,The Ordinary Glucoside Foaming Cleanser(150ml),4.4/5,599ratings&36reviews,₹1400,N/A,No Discount,None,In Stock
The Ordinary.,The Ordinary Natural Moisturising Factors + Ha for scalp(60ml),4.4/5,370ratings&48reviews,₹1650,N/A,No Discount,None,In Stock
The Ordinary.,The Ordinary Aloe 2% + NAG 2% Solution(30ml),4.3/5,462ratings&43reviews,₹1500,N/A,No Discount,None,In Stock
The Ordinary.,The Ordinary Salicylic Acid 2% Anhydrous Solution(30ml),4.2/5,2100ratings&223reviews,₹650,N/A,No Discount,None,In Stock
The Ordinary.,The Ordinary Natural Moisturizing Factors + PhytoCeramides(100ml),4.5/5,100ratings&11reviews,₹2400,N/A,No Discount,None,In Stock
The Ordinary.,The Ordinary 100% Organic Cold-Pressed Moroccan Argan Oil(30ml),4.4/5,485ratings&65reviews,₹800,N/A,No Discount,None,In Stock
The Ordinary.,The Ordinary Niacinamide 5% Face & Body Emulsion(100ml),4.7/5,17ratings&3reviews,₹1400,N/A,No Discount,None,In Stock
The Ordinary.,The Ordinary 100% Plant-Derived Squalane(30ml),4.4/5,752ratings&71reviews,₹1050,N/A,No Discount,None,In Stock
The Ordinary.,The Ordinary Natural Moisturizing Factors + Inulin Body Lotion(240ml),4.6/5,8ratings&1reviews,₹1500,N/A,No Discount,None,In Stock
The Ordinary.,The Ordinary The Most-Loved Set(45ml),4.3/5,318ratings&14reviews,₹1550,N/A,No Discount,None,In Stock
The Ordinary.,The Ordinary Mandelic Acid 10% + HA(30ml),4.4/5,480ratings&40reviews,₹800,N/A,No Discount,None,In Stock
The Ordinary.,The Ordinary High-Adherence Silicone Primer(30ml),4.3/5,636ratings&51reviews,₹700,N/A,No Discount,None,In Stock
The Ordinary.,The Ordinary Marine Hyaluronics(30ml),4.3/5,753ratings&89reviews,₹900,N/A,No Discount,None,In Stock
The Ordinary.,The Ordinary EUK 134 0.1%(30ml),4.3/5,208ratings&26reviews,₹1150,N/A,No Discount,None,In Stock
The Ordinary.,The Ordinary Glycolipid Cream Cleanser(150ml),4.3/5,66ratings&6reviews,₹1350,N/A,No Discount,None,In Stock
The Ordinary.,The Ordinary Pycnogenol 5%(15ml),4.3/5,254ratings&38reviews,₹1150,N/A,No Discount,None,In Stock
The Ordinary.,The Ordinary 100% Organic Cold-Pressed Rose Hip Seed Oil(30ml),4.3/5,612ratings&59reviews,₹1250,N/A,No Discount,None,Out Of Stock
