Product Brand,Product Name,Product Rating,Product Rating & Review Count,Product Original Price,Product Offer Price,Product Discount,Product Highlight,Product Stock Status
M.A.C,M.A.C Kohl Power Eye Pencil - Feline (Rich Black)(1.5g),3.2/5,21ratings&6reviews,₹1700,N/A,No Discount,None,Out Of Stock
M.A.C,M.A.C Three Cheers! Lipstick Trio - Destined For Stardom(3 pcs),4.3/5,3ratings,₹3350,N/A,No Discount,None,Out Of Stock
M.A.C,M.A.C Retro Matte Lipstick - Runway Hit(3g),4.5/5,7291ratings&1653reviews,₹1750,N/A,No Discount,None,Out Of Stock
M.A.C,M.A.C Prep+Prime Fix+ - Lunar Collection - Original(1 gms),4.6/5,45ratings&6reviews,₹2400,N/A,No Discount,None,Out Of Stock
M.A.C,M.A.C Extra Dimension Trio Pearlescence Collection Palette(1 gms),4.8/5,6ratings,₹6200,N/A,No Discount,None,Out Of Stock
M.A.C,M.A.C Foundation Pump(1N),4.4/5,152ratings&27reviews,₹1000,N/A,No Discount,None,Out Of Stock
M.A.C,M.A.C Eye Shadow X 9 - Amber Times Nine(5.85gm),4.4/5,209ratings&55reviews,₹3900,N/A,No Discount,None,Out Of Stock
M.A.C,M.A.C Prep + Prime Moisture Infusion(50ml),4.7/5,90ratings&9reviews,₹3750,N/A,No Discount,None,Out Of Stock
M.A.C,M.A.C Colour Excess Gel Liner Pearlescence Collection - Stay The Night(1 gms),4/5,17ratings&1reviews,₹2200,N/A,No Discount,None,Out Of Stock
M.A.C,M.A.C #Self-Care Skincare Duo - Mattify(1 gms),4.8/5,24ratings,₹5000,N/A,No Discount,None,Out Of Stock
M.A.C,M.A.C Colour Excess Gel Pencil- Holiday Collection Gleam On(1 gms),3.7/5,3ratings,₹2500,N/A,No Discount,None,Out Of Stock
M.A.C,M.A.C Lip Pencil - Deeply Teddy (Teddy Collection)(1 gms),4/5,3ratings&2reviews,₹2200,N/A,No Discount,None,Out Of Stock
M.A.C,M.A.C Eye Brows Styler - Spiked(0.09g),4.6/5,406ratings&40reviews,₹1900,N/A,No Discount,None,Out Of Stock
M.A.C,M.A.C Prep + Prime Lip (Teddy Collection)(1 gms),5/5,1ratings,₹2550,N/A,No Discount,None,Out Of Stock
M.A.C,M.A.C Lips By The Dozen Mini Powder Kiss Lipstick X 12- Holiday Collection Na(1 gms),3.4/5,5ratings,₹11000,N/A,No Discount,None,Out Of Stock
M.A.C,M.A.C Lustrelite Mini Lipstick Trio: Pink- Holiday Collection Pink(1 gms),4.2/5,21ratings&2reviews,₹3200,N/A,No Discount,None,Out Of Stock
M.A.C,M.A.C Extra Dimension Skinfinish- Lunar Collection - Beaming Blush(9 g),N/A,None,₹3900,N/A,No Discount,None,Out Of Stock
M.A.C,M.A.C Lustrelite Mini Lipstick Trio: Neutral- Holiday Collection Neutral(1 gms),4/5,33ratings&3reviews,₹3200,N/A,No Discount,None,Out Of Stock
M.A.C,M.A.C Hail To The Chic! Lipstick Trio- Holiday Collection Hail To The Chick!(1 gms),4.3/5,75ratings&7reviews,₹4800,N/A,No Discount,None,Out Of Stock
M.A.C,M.A.C Sparkler Eyeshadow- Holiday Collection Gold Crush(1 gms),5/5,1ratings,₹2400,N/A,No Discount,None,Out Of Stock
M.A.C,M.A.C Amplified Lipstick / Stripdown - Smoked Almond,4.4/5,78ratings&17reviews,₹1750,N/A,No Discount,None,Out Of Stock
M.A.C,M.A.C Lip Scrubtious Primer - Sweet Vanilla(14ml),4.4/5,138ratings&45reviews,₹1650,N/A,No Discount,None,Out Of Stock
M.A.C,M.A.C Ruby's Crew: Powder Kiss Liquid Lipcolour - Ruby Boo,3.8/5,15ratings&2reviews,₹2450,N/A,No Discount,None,Out Of Stock
M.A.C,M.A.C Powdered Snow Powder Kiss Lip Kit: Brown- Holiday Collection Na(1 gms),4.7/5,23ratings&6reviews,₹5500,N/A,No Discount,None,Out Of Stock
M.A.C,M.A.C Throwbacks Lipstick - Marrakesh (Matte)(3g),4.5/5,162ratings&40reviews,₹1750,N/A,No Discount,None,Out Of Stock
M.A.C,M.A.C Brow Set(8gm),4.2/5,72ratings&15reviews,₹1850,N/A,No Discount,None,Out Of Stock
M.A.C,M.A.C Lustreglass Lipstick - Ready Teddy (Teddy Collection)(1 gms),5/5,1ratings,₹2800,N/A,No Discount,None,Out Of Stock
M.A.C,M.A.C Retro Matte Lipstick - Eternal Teddy (Teddy Collection)(1 gms),N/A,None,₹2550,N/A,No Discount,None,Out Of Stock
M.A.C,M.A.C #Self-Care Skincare Duo - Hydrate(1 gms),4.2/5,12ratings&1reviews,₹5200,N/A,No Discount,None,Out Of Stock
M.A.C,M.A.C Colour Excess Gel Liner - Sick Tat Bro (Teddy Collection)(1 gms),5/5,1ratings,₹2500,N/A,No Discount,None,Out Of Stock
M.A.C,M.A.C Powder Kiss Velvet Blur Slim Stick- Holiday Collection Cocoa Kisses(1 gms),4/5,5ratings,₹3400,N/A,No Discount,None,Out Of Stock
M.A.C,M.A.C Shape + Shade Brow Tint - Spiked(0.95g),4.4/5,66ratings&18reviews,₹2100,N/A,No Discount,None,Out Of Stock
M.A.C,M.A.C Lipglass Lip Gloss - Teddy's Pal (Teddy Collection)(1 gms),N/A,None,₹2400,N/A,No Discount,None,Out Of Stock
M.A.C,M.A.C RubyS Crew/ Powder Kiss Liquid Lipcolour - Ruby Boo,4.3/5,32ratings&9reviews,₹2450,N/A,No Discount,None,Out Of Stock
M.A.C,M.A.C Matte Lipstick - Lunar Collection - Chili(1 gms),4.6/5,24ratings&4reviews,₹2150,N/A,No Discount,None,Out Of Stock
M.A.C,M.A.C Powder Kiss Liquid Lipcolour - Chili’s Crew(1 gms),3.8/5,4ratings&1reviews,₹2700,N/A,No Discount,None,Out Of Stock
M.A.C,M.A.C Sparkler Eyeshadow- Holiday Collection Zero Chill(1 gms),5/5,3ratings,₹2400,N/A,No Discount,None,Out Of Stock
M.A.C,M.A.C Lash - 7(1 pair),4.4/5,5ratings&1reviews,₹1400,N/A,No Discount,None,Out Of Stock
M.A.C,M.A.C Powder Kiss Velvet Blur Slim Stick- Holiday Collection Peppery Pink(1 gms),4.3/5,3ratings&1reviews,₹3400,N/A,No Discount,None,Out Of Stock
M.A.C,M.A.C Lash - 36(1 pair),4.8/5,11ratings&1reviews,₹1500,N/A,No Discount,None,Out Of Stock
M.A.C,M.A.C Eye Brows Styler - Onyx(0.09gm),N/A,None,₹1900,N/A,No Discount,None,Out Of Stock
