Product Brand,Product Name,Product Rating,Product Rating & Review Count,Product Original Price,Product Offer Price,Product Discount,Product Highlight,Product Stock Status
M.A.C,M.A.C MACximal Satin Lipstick - Creme In Your Coffee(3.5g),4.1/5,44ratings&16reviews,₹2550,N/A,No Discount,None,In Stock
M.A.C,M.A.C Strobe Cream Mini - Pinklite Illuminating Moisturizer & Liquid Highlighter,4.4/5,15575ratings&1342reviews,₹1400,N/A,No Discount,BESTSELLER,In Stock
M.A.C,M.A.C Studio Fix Powder Plus Compact Foundation - NC42(15gm),4.4/5,18824ratings&1835reviews,₹3900,N/A,No Discount,BESTSELLER,In Stock
M.A.C,M.A.C MACximal Mini Matte Nude Lipstick - Mehr(1.7g),4.4/5,30727ratings&5295reviews,₹1650,N/A,No Discount,BESTSELLER,In Stock
M.A.C,M.A.C Prep + Prime Fix+ (Alcohol Free) Setting Spray - Original (Makeup Fixer) With Green Tea(100ml),4.5/5,285ratings&19reviews,₹2700,N/A,No Discount,BESTSELLER,In Stock
M.A.C,M.A.C Studio Fix Fluid SPF 15 Soft Matte Foundation With Hyaluronic Acid - NC20(30ml),4.4/5,13458ratings&1668reviews,₹4000,N/A,No Discount,BESTSELLER,In Stock
M.A.C,"M.A.C Glow Play Cushiony Blush - Blush, Please(7.3g)",3.9/5,24ratings&2reviews,₹3800,N/A,No Discount,None,In Stock
M.A.C,M.A.C MACximal Matte Lipstick - Ruby Woo(3.5g),4.5/5,8788ratings&1687reviews,₹2550,N/A,No Discount,BESTSELLER,In Stock
M.A.C,M.A.C In Extreme Dimension 24Hr Waterproof & Smudgeproof Kajal Eye Liner(0.8gm),4.3/5,10437ratings&1047reviews,₹850,N/A,No Discount,None,In Stock
M.A.C,M.A.C Glow Play Tender Talk Lip Balm - Serve(3.14g),4.7/5,25ratings&8reviews,₹3000,N/A,No Discount,None,In Stock
M.A.C,M.A.C Studio Fix Fluid SPF 15 Mini Soft Matte Foundation With Hyaluronic Acid - NC15(15ml),4.4/5,17400ratings&1023reviews,₹2250,N/A,No Discount,BESTSELLER,In Stock
M.A.C,M.A.C Strobe Cream - Pinklite | Illuminating Moisturizer & Liquid Highlighter(50ml),4.5/5,5434ratings&753reviews,₹4200,N/A,No Discount,BESTSELLER,In Stock
M.A.C,M.A.C Prep + Prime Fix+ Setting Spray (Makeup Fixer) - Travel Size(13ml),4.4/5,18204ratings&1201reviews,₹850,N/A,No Discount,None,In Stock
M.A.C,M.A.C Retro Matte Liquid Lipcolour - Burnt Spice(5ml),4.4/5,4394ratings&879reviews,₹2800,N/A,No Discount,None,In Stock
M.A.C,M.A.C Powder Kiss Lipstick - Burning Love(3g),4.4/5,3664ratings&656reviews,₹2800,N/A,No Discount,None,In Stock
M.A.C,M.A.C Studio Fix Conceal and Correct Palette - Medium Deep(Singles),4.5/5,1610ratings&176reviews,₹5450,N/A,No Discount,None,In Stock
M.A.C,M.A.C Studio Radiance Serum-Powered Foundation - NC20(30ml),4.4/5,580ratings&34reviews,₹4300,N/A,No Discount,None,In Stock
M.A.C,M.A.C Lip Pencil - Soar(1.45g),4.5/5,1983ratings&316reviews,₹2300,N/A,No Discount,None,In Stock
M.A.C,M.A.C Locked Kiss Ink Liquid Lipstick - Decadence(1 gms),4.5/5,870ratings&116reviews,₹3150,N/A,No Discount,None,In Stock
M.A.C,M.A.C Fix + (Stay Over Alcohol Free - Long Lasting) - Setting Spray (Makeup Fixer)(100ml),4.5/5,668ratings&30reviews,₹3200,N/A,No Discount,None,In Stock
M.A.C,M.A.C Powder Kiss Liquid Lipcolour - More The Mehr-Ier(5ml),4.3/5,2620ratings&473reviews,₹3100,N/A,No Discount,None,In Stock
M.A.C,M.A.C Mineralize Skinfinish Highlighter - Soft & Gentle(Singles),4.5/5,2323ratings&328reviews,₹4000,N/A,No Discount,None,In Stock
M.A.C,M.A.C Prep + Prime Natural Radiance Primer - Radiant Pink(50ml),4.5/5,1105ratings&92reviews,₹4300,N/A,No Discount,None,In Stock
M.A.C,M.A.C Locked Kiss Lipstick - Connoisseur(1 gms),4.1/5,585ratings&69reviews,₹3150,N/A,No Discount,None,In Stock
M.A.C,M.A.C Studio Fix 24-Hour Smooth Wear Concealer - NC42(7ml),4.4/5,1587ratings&127reviews,₹3000,N/A,No Discount,None,In Stock
M.A.C,"M.A.C Hyper Real Skincanvas Balm Moisturizer With Niacinamide, Hyaluronic Acid & Ceramide(50ml)",4.4/5,369ratings&23reviews,₹5500,N/A,No Discount,None,In Stock
M.A.C,M.A.C Matte Powder Blush - Melba(6g),4.5/5,1439ratings&229reviews,₹3100,N/A,No Discount,None,In Stock
M.A.C,M.A.C Squirt Plumping Lip Gloss Stick - Heat Sensor(2.3g),4.3/5,535ratings&69reviews,₹2300,N/A,No Discount,None,In Stock
M.A.C,M.A.C. Colour Excess Gel Pencil Eye Liner- Sick Tat Bro Kajal(1 gms),4.4/5,481ratings&41reviews,₹2250,N/A,No Discount,None,In Stock
M.A.C,M.A.C Studio Radiance 24HR Luminous Lift Concealer - NC35(11ml),4.4/5,14ratings,₹3100,N/A,No Discount,None,In Stock
M.A.C,M.A.C Studio Fix Every-Wear All-Over Face Pen - NC20(12ml),4.3/5,452ratings&45reviews,₹3000,N/A,No Discount,None,In Stock
M.A.C,M.A.C Pro Longwear Fluidline Eyeliner Gel - Blacktrack(3g),4.4/5,1048ratings&131reviews,₹1850,N/A,No Discount,None,In Stock
M.A.C,M.A.C Studio Fix Pro Set + Blur Weightless Loose Powder - Medium(1 gms),4.5/5,344ratings&16reviews,₹2950,N/A,No Discount,None,In Stock
M.A.C,M.A.C Liquidlast Liner - Point Black(2.5ml),4.3/5,556ratings&83reviews,₹3100,N/A,No Discount,None,In Stock
M.A.C,M.A.C Retro Matte Lipstick - Firewerk (Embroidered Opulence Collection)(3g),4.6/5,82ratings&14reviews,₹2800,N/A,No Discount,None,In Stock
M.A.C,M.A.C Strobe Dewy Skin Tint - Light(1 gms),4.2/5,451ratings&34reviews,₹3300,N/A,No Discount,None,In Stock
M.A.C,M.A.C Pro Brow Definer - Spiked(1 gms),3.6/5,20ratings&3reviews,₹2700,N/A,No Discount,None,In Stock
M.A.C,"M.A.C Hyper Real Serumizer Skin Balancing Serum With Niacinamide, Hyaluronic Acid & Ceramides(30ml)",4.5/5,241ratings&15reviews,₹6500,N/A,No Discount,None,In Stock
M.A.C,"M.A.C Lustreglass Lipstick - Beam There, Done That(Singles)",4.6/5,342ratings&39reviews,₹2800,N/A,No Discount,None,In Stock
M.A.C,M.A.C Connect In Colour Eye Shadow Palette X12 - Unfiltered Nudes(12.2 g),4.4/5,75ratings&10reviews,₹5700,N/A,No Discount,None,In Stock
M.A.C,M.A.C Connect In Colour Eye Shadow Palette X6 - Rose Lens(6.25 g),4.5/5,164ratings&10reviews,₹3900,N/A,No Discount,None,In Stock
M.A.C,M.A.C MACximal Satin Mini Lipstick - Dubonnet(1.8g),4.2/5,42ratings&6reviews,₹1650,N/A,No Discount,None,In Stock
M.A.C,M.A.C Pro Longwear Concealer - NC35(9ml),4.3/5,814ratings&121reviews,₹3350,N/A,No Discount,None,In Stock
M.A.C,M.A.C Sheertone Blush - Peaches(6g),4.5/5,622ratings&82reviews,₹3100,N/A,No Discount,None,In Stock
M.A.C,M.A.C Powder Kiss Velvet Blur Slim Stick - Mullit Over(1g),4.4/5,652ratings&85reviews,₹3100,N/A,No Discount,None,In Stock
M.A.C,M.A.C Macstack Mascara - Black Stack(8ml),4.4/5,533ratings&44reviews,₹2200,N/A,No Discount,None,In Stock
M.A.C,M.A.C Lipglass - Love Child(3.1ml),4.3/5,538ratings&79reviews,₹2200,N/A,No Discount,None,In Stock
M.A.C,M.A.C Eye Kohl - Smolder(1.36g),4.1/5,289ratings&39reviews,₹2050,N/A,No Discount,None,In Stock
M.A.C,M.A.C MACximal Silky Matte Viva Glam Lipstick - Viva Empowered(1 gms),4.6/5,34ratings&7reviews,₹2550,N/A,No Discount,None,In Stock
M.A.C,M.A.C In Extreme Dimension Lash Mascara / Mini - 3D Black(4gm),4.3/5,1305ratings&190reviews,₹1500,N/A,No Discount,None,In Stock
M.A.C,M.A.C Prep + Prime Lip(1.7g),4.5/5,395ratings&69reviews,₹2300,N/A,No Discount,None,In Stock
M.A.C,M.A.C Brush Cleanser(235ml),4.5/5,432ratings&84reviews,₹1550,N/A,No Discount,None,In Stock
M.A.C,M.A.C Lustreglass Lipstick - Like I Was Saying(3g),5/5,4ratings&1reviews,₹2800,N/A,No Discount,None,In Stock
M.A.C,M.A.C Studio Finish SPF 35 - NC25(7gm),4.4/5,1697ratings&187reviews,₹2950,N/A,No Discount,None,In Stock
M.A.C,M.A.C Satin Lipstick - Find The Light (Embroidered Opulence Collection)(3g),4.5/5,25ratings&9reviews,₹2800,N/A,No Discount,None,In Stock
M.A.C,M.A.C Eye Brows Big Boost Fibre Gel - Stud(4.1g),4.4/5,199ratings&24reviews,₹2350,N/A,No Discount,None,In Stock
M.A.C,"M.A.C Mini Hyper Real Skincanvas Balm Moisturizer With Niacinamide, Hyaluronic Acid & Ceramide(15ml)",4.4/5,369ratings&23reviews,₹2400,N/A,No Discount,None,In Stock
M.A.C,M.A.C Viva Glam Bhumi Pednekar Powder KissLipstick(1 gms),4.4/5,198ratings&31reviews,₹2550,N/A,No Discount,None,In Stock
M.A.C,M.A.C Gently Off Eye and Lip Makeup Remover(100ml),4.2/5,101ratings&14reviews,₹2850,N/A,No Discount,None,In Stock
M.A.C,"M.A.C Mini Hyper Real Serumizer Skin Balancing Serum With Niacinamide, Hyaluronic Acid & Ceramides(15ml)",4.5/5,241ratings&15reviews,₹3400,N/A,No Discount,None,In Stock
M.A.C,"M.A.C Mini Hyper Real Serumizer Skin Balancing Serum With Niacinamide, Hyaluronic Acid & Ceramides(15ml)",4.5/5,241ratings&15reviews,₹3400,N/A,No Discount,None,In Stock
M.A.C,M.A.C Dazzleshadow Liquid - Every Day Is Sunshine(4.6gm),4.3/5,180ratings&25reviews,₹2550,N/A,No Discount,None,In Stock
M.A.C,M.A.C Prep + Prime Pore Refiner Stick(7gm),4.3/5,230ratings&26reviews,₹3600,N/A,No Discount,None,In Stock
M.A.C,M.A.C Frost Lipstick - New York Apple(3g),4.3/5,216ratings&27reviews,₹2550,N/A,No Discount,None,In Stock
M.A.C,M.A.C Fast Response Eye Cream with Instant benefit/with caffeine(15ml),4.4/5,102ratings&10reviews,₹3700,N/A,No Discount,None,In Stock
M.A.C,M.A.C Mineralize Blush - Petal Power,4.5/5,286ratings&36reviews,₹3650,N/A,No Discount,None,In Stock
M.A.C,M.A.C Pro Longwear Paint Pot - Layin' Low(5gm),4.4/5,224ratings&40reviews,₹3100,N/A,No Discount,None,In Stock
M.A.C,M.A.C Prep + Prime Face Protect Lotion SPF 50(30ml),4.5/5,15ratings&2reviews,₹4400,N/A,No Discount,None,In Stock
M.A.C,M.A.C Studio Fix Tech Cream-To-Powder Foundation - NW25(10g),4.3/5,417ratings&44reviews,₹3850,N/A,No Discount,None,In Stock
M.A.C,M.A.C Powder Blush - Fleur Power(6g),4.4/5,128ratings&21reviews,₹3100,N/A,No Discount,None,In Stock
M.A.C,M.A.C Lustreglass Lipstick - Thanks it's MAC(3 g),4.2/5,8ratings&1reviews,₹2800,N/A,No Discount,None,In Stock
M.A.C,M.A.C Skinfinish Sunstruck Matte Bronzer - Matte Deep Golden(1 gms),3.9/5,42ratings&3reviews,₹3500,N/A,No Discount,None,In Stock
M.A.C,M.A.C Studio Fix Mattifine 12Hr Shine-Control Primer(30ml),4.4/5,79ratings&9reviews,₹3600,N/A,No Discount,None,In Stock
M.A.C,M.A.C Molten Metal Highlighter - Bling-A-Ling! (Embroidered Opulence Collection)(14ml),4.4/5,7ratings&1reviews,₹3800,N/A,No Discount,None,In Stock
M.A.C,M.A.C Hyper Real Glow Palette / Flash + Awe(4.5gm Each),4/5,98ratings&6reviews,₹6500,N/A,No Discount,None,In Stock
M.A.C,M.A.C In Extreme Dimension Waterproof Mascara Lash - Dimensional Black(13.39gm),4.4/5,193ratings&31reviews,₹2950,N/A,No Discount,None,In Stock
M.A.C,M.A.C Satin Lipstick - Film Noir(3g),4.5/5,1582ratings&291reviews,₹2550,N/A,No Discount,None,In Stock
M.A.C,M.A.C Powder Kiss Eye Shadow - Fall In Love(1.5g),4.6/5,241ratings&46reviews,₹2400,N/A,No Discount,None,In Stock
M.A.C,M.A.C Prep + Prime Fix+ Setting Spray - Magic Radiance (Makeup Fixer) With Hyaluronic Acid(100ml),4.8/5,11ratings&1reviews,₹3000,N/A,No Discount,None,In Stock
M.A.C,M.A.C Skinfinish Cream Blush - Priceless Purple(5.7 g),5/5,1ratings,₹4000,N/A,No Discount,None,In Stock
M.A.C,M.A.C Hyper Real Fresh Canvas Cream-To-Foam Cleanser With Cationic Hyaluronic Acid & Glycerin(125ml),3.6/5,7ratings&1reviews,₹2900,N/A,No Discount,None,In Stock
M.A.C,M.A.C Prep + Prime 24-Hour Extend Eye Base(12ml),4.4/5,93ratings&10reviews,₹2700,N/A,No Discount,None,In Stock
M.A.C,M.A.C Glow Play Blush - Groovy(7.3gm),4.2/5,370ratings&76reviews,₹3400,N/A,No Discount,None,In Stock
M.A.C,M.A.C Ruby's Crew: Retro Matte Liquid Lipcolour - Ruby Phew!(5ml),4.6/5,72ratings&7reviews,₹2800,N/A,No Discount,None,In Stock
M.A.C,M.A.C Studio Radiance Moisturizing + Illuminating Silky Primer,4.4/5,120ratings&3reviews,₹3600,N/A,No Discount,None,In Stock
M.A.C,"M.A.C Extra Dimension Skinfinish Powder - Oh, Darling!(9gm)",4.2/5,335ratings&25reviews,₹4000,N/A,No Discount,None,In Stock
M.A.C,M.A.C Frost Eye Shadow - Amber Lights(1.5g),4.4/5,100ratings&24reviews,₹2150,N/A,No Discount,None,In Stock
M.A.C,M.A.C Claim To Fame Lip Trio - Velvet Teddy(69.06 g),5/5,1ratings&1reviews,₹3900,N/A,No Discount,None,In Stock
M.A.C,M.A.C Satin Eye Shadow - Brun(1.5g),4.8/5,72ratings&4reviews,₹2150,N/A,No Discount,None,In Stock
M.A.C,M.A.C Mineralize Timecheck Lotion(30ml),4.4/5,30ratings,₹4400,N/A,No Discount,None,In Stock
M.A.C,M.A.C Full Lash Curler,3.8/5,37ratings&8reviews,₹3700,N/A,No Discount,None,In Stock
M.A.C,M.A.C Claim To Fame Lip Trio - Ruby Woo(69.06 g),N/A,None,₹3900,N/A,No Discount,None,In Stock
M.A.C,M.A.C Lip Pencil - Greige(1.45g),3.5/5,4ratings&1reviews,₹2300,N/A,No Discount,None,In Stock
M.A.C,M.A.C Lip Pencil - Beige-Turner(1.45g),3/5,2ratings,₹2300,N/A,No Discount,None,In Stock
M.A.C,M.A.C Lip Pencil - Root For Me!(1.45g),5/5,1ratings,₹2300,N/A,No Discount,None,In Stock
M.A.C,M.A.C Gilded Glamour Bestsellers Trio(155.94 g),4.5/5,2ratings,₹4500,N/A,No Discount,None,In Stock
M.A.C,M.A.C Eye Shadow Palette X6 - All The Riches(111 g),N/A,None,₹4700,N/A,No Discount,None,In Stock
M.A.C,M.A.C Eye Shadow X6 - Embroidered Opulence (Embroidered Opulence Collection)(7.2g),4.8/5,6ratings&1reviews,₹4200,N/A,No Discount,None,In Stock
M.A.C,M.A.C Dazzleshadow - Slow/Fast/Slow(1.0g),4.4/5,87ratings&14reviews,₹2400,N/A,No Discount,None,In Stock
M.A.C,M.A.C Macximal Matte Lipstick - Warm Teddy(3.5g),N/A,None,₹2550,N/A,No Discount,None,In Stock
M.A.C,M.A.C Macximal Matte Lipstick - Warm Teddy(3.5g),N/A,None,₹2550,N/A,No Discount,None,In Stock
M.A.C,M.A.C Pencil Sharpener - Universal(1N),4.5/5,89ratings&14reviews,₹1100,N/A,No Discount,None,In Stock
M.A.C,M.A.C Colour Excess Gel Liner - Spark Gold (Embroidered Opulence Collection)(0.35g),5/5,5ratings,₹2500,N/A,No Discount,None,In Stock
M.A.C,M.A.C Love Me Lipstick - Give me Fever(Singles),4.4/5,777ratings&188reviews,₹2200,N/A,No Discount,None,In Stock
M.A.C,M.A.C Foundation Brush - 190(19cm),3.9/5,13ratings&3reviews,₹3850,N/A,No Discount,None,In Stock
M.A.C,M.A.C Cream Colour Base - Improper Copper(3.2g),4.4/5,71ratings&16reviews,₹2900,N/A,No Discount,None,In Stock
M.A.C,M.A.C Precise Eye Liner Brush - 210(15cm),4.2/5,41ratings&3reviews,₹2450,N/A,No Discount,None,In Stock
M.A.C,M.A.C Matte Eye Shadow - Embark(1.5g),4.4/5,83ratings&16reviews,₹2150,N/A,No Discount,None,In Stock
M.A.C,M.A.C Powdered Snow Powder Kiss Lip Kit: Pink- Holiday Collection Na(1 gms),4.8/5,6ratings&2reviews,₹5500,N/A,No Discount,None,In Stock
M.A.C,M.A.C Lusterglass Lipstick - Luck Has It(1 gms),4.6/5,7ratings&1reviews,₹2800,N/A,No Discount,None,In Stock
M.A.C,M.A.C Veluxe Pearl Eye Shadow - Expensive Pink(1.3g),4.5/5,55ratings&12reviews,₹2150,N/A,No Discount,None,In Stock
M.A.C,M.A.C Set For Success Fix+ Duo(160 g),N/A,None,₹3400,N/A,No Discount,None,In Stock
M.A.C,M.A.C Frosted Blur Primer- Holiday Collection Cool + Clear(1 gms),4/5,6ratings,₹3300,N/A,No Discount,None,In Stock
M.A.C,M.A.C Snow Peony Hyper Real Kit- Holiday Collection Na(131.6 g),5/5,3ratings,₹4700,N/A,No Discount,None,In Stock
M.A.C,M.A.C Gold Tier Mini Lip + Lash Duo(40.3 g),N/A,None,₹2900,N/A,No Discount,None,In Stock
M.A.C,M.A.C Eye Shadow - In The Shadows Frost(1.5g),4.2/5,32ratings&5reviews,₹2150,N/A,No Discount,None,In Stock
M.A.C,M.A.C Amplified Lipstick - Dubonnet(3g),4.4/5,536ratings&123reviews,₹2300,N/A,No Discount,None,In Stock
M.A.C,M.A.C 187 Synthetic Duo Fibre Face Brush,3.4/5,5ratings&2reviews,₹6400,N/A,No Discount,None,In Stock
M.A.C,M.A.C Lip Pencil - Brick-O-La(1.45g),5/5,1ratings&1reviews,₹2300,N/A,No Discount,None,In Stock
M.A.C,M.A.C Cremesheen Lipstick - Brave Red(3g),4.5/5,433ratings&97reviews,₹2300,N/A,No Discount,None,In Stock
M.A.C,M.A.C Eye Love Surprises Eye Shadow Palette X 6 - Best-Sellers(8.6 g),2/5,2ratings,₹5000,N/A,No Discount,None,In Stock
M.A.C,M.A.C Macstack Mascara - Brush Stack (Teddy Collection)(1 gms),N/A,None,₹3650,N/A,No Discount,None,In Stock
M.A.C,M.A.C Matte Viva Glam Lipstick - 618 Viva Glam I(3g),4.5/5,98ratings&16reviews,₹1950,N/A,No Discount,None,In Stock
M.A.C,M.A.C Eye Shadow X12 Palette Pearlescence Collection(1 gms),4.5/5,2ratings,₹6250,N/A,No Discount,None,In Stock
M.A.C,M.A.C Pro Longwear Nourishing Waterproof Foundation - NC45(25ml),4.2/5,344ratings&41reviews,₹3850,N/A,No Discount,None,In Stock
M.A.C,M.A.C Molton Metal Highlighter - Many Moons Aglow!(1 gms),4.5/5,2ratings,₹4000,N/A,No Discount,None,In Stock
M.A.C,M.A.C Studio Radiance Serum-Powered Foundation - NC11(30ml),N/A,None,₹4300,N/A,No Discount,None,In Stock
M.A.C,M.A.C Retractable Lip Brush - 318(9cm),4.7/5,18ratings&3reviews,₹2950,N/A,No Discount,None,In Stock
M.A.C,M.A.C Thermo-status Bestsellers Kit- Holiday Collection Na(44g),3.8/5,4ratings&2reviews,₹5800,N/A,No Discount,None,In Stock
M.A.C,M.A.C Macximal Matte Lipstick - Get The Hint?(3.5g),N/A,None,₹2550,N/A,No Discount,None,In Stock
M.A.C,M.A.C Powder Kiss Velvet Blur Slim Stick- Holiday Collection Merry Cherry(1 gms),5/5,2ratings,₹3400,N/A,No Discount,None,In Stock
M.A.C,M.A.C Glow Play Blush-Lunar Collection - Heat Index(7.3 g),N/A,None,₹3750,N/A,No Discount,None,In Stock
M.A.C,M.A.C Chili's Crew - Pk Velvet Blur-wn(2 g),4.7/5,6ratings&1reviews,₹2700,N/A,No Discount,None,In Stock
M.A.C,M.A.C True Or False Lashes - 81 Charmer Lash(1Pair),4.7/5,16ratings&2reviews,₹2150,N/A,No Discount,None,In Stock
M.A.C,M.A.C Pencil Brush - 219S,4.9/5,10ratings&1reviews,₹3250,N/A,No Discount,None,In Stock
M.A.C,M.A.C Macstack Mascara - Black Stack(12ml),N/A,None,₹3500,N/A,No Discount,None,In Stock
M.A.C,M.A.C Teddy Takeover Eye & Face Palette: Deep (Teddy Collection)(1 gms),N/A,None,₹5400,N/A,No Discount,None,In Stock
M.A.C,M.A.C Macximal Matte Lipstick - Sweet Deal(3.5g),N/A,None,₹2550,N/A,No Discount,None,In Stock
M.A.C,M.A.C Winter Wonderglam Look In A Box- Holiday Collection Na(134 g),5/5,2ratings,₹7000,N/A,No Discount,None,In Stock
M.A.C,M.A.C Lip Pencil - Flamingo(1.45g),N/A,None,₹2300,N/A,No Discount,None,In Stock
M.A.C,M.A.C Sparkler Eyeshadow- Holiday Collection Jingle Tingle(1 gms),3.8/5,5ratings&1reviews,₹2400,N/A,No Discount,None,In Stock
M.A.C,M.A.C Colour Excess Gel Pencil- Holiday Collection Blurrring Blue(1 gms),2.4/5,5ratings,₹2500,N/A,No Discount,None,In Stock
M.A.C,M.A.C Blending Brush - 217S,4.3/5,29ratings&3reviews,₹3000,N/A,No Discount,None,In Stock
M.A.C,M.A.C Eye-Con Status Lash + Liner Duo(42 g),N/A,None,₹3900,N/A,No Discount,None,In Stock
M.A.C,M.A.C True Or False Lashes - 87 Maximalist Lash(1Pair),2.5/5,2ratings&1reviews,₹1650,N/A,No Discount,None,In Stock
M.A.C,M.A.C Mini Mac (colour)clear(1 gms),3.4/5,5ratings&1reviews,₹1400,N/A,No Discount,None,In Stock
M.A.C,M.A.C Holy Grail Mini Hyper Real Kit(175.02 g),N/A,None,₹6500,N/A,No Discount,None,In Stock
M.A.C,M.A.C True Or False Lashes - 82 Seductress Lash(1Pair),4.8/5,4ratings,₹2150,N/A,No Discount,None,In Stock
M.A.C,M.A.C True Or False Lashes - 86 Opportunist Lash(1Pair),2.5/5,2ratings,₹1650,N/A,No Discount,None,In Stock
M.A.C,M.A.C Lip Pencil - Center Of Attention(1.45g),5/5,1ratings&1reviews,₹2300,N/A,No Discount,None,In Stock
M.A.C,M.A.C True Or False Lashes - 89 Megastar Lash(1Pair),3.9/5,12ratings,₹2150,N/A,No Discount,None,In Stock
M.A.C,M.A.C Macstack Mascara- Lunar Collection -Black Stack(1 gms),5/5,3ratings,₹3100,N/A,No Discount,None,In Stock
M.A.C,M.A.C True Or False Lashes - 83 Siren Lash(1Pair),3.2/5,5ratings,₹2150,N/A,No Discount,None,In Stock
M.A.C,M.A.C Lip Pencil - Grape Expectations(1.45g),N/A,None,₹2300,N/A,No Discount,None,In Stock
M.A.C,M.A.C Macximal Matte Lipstick - Keep Dreaming(3.5g),N/A,None,₹2550,N/A,No Discount,None,In Stock
M.A.C,M.A.C Squall Goals Eye Shadow Palette X6: Sparkle Storm- Holiday Collection Sparkle Storm(1 gms),5/5,2ratings&1reviews,₹4800,N/A,No Discount,None,In Stock
M.A.C,M.A.C Prime Goldmine Duo - Radiant(21.75 g),N/A,None,₹5000,N/A,No Discount,None,In Stock
M.A.C,M.A.C Macximal Matte Lipstick - Flamingo(3.5g),N/A,None,₹2550,N/A,No Discount,None,In Stock
M.A.C,M.A.C Lip Pencil - Chili Rimmed(1.45g),N/A,None,₹2300,N/A,No Discount,None,In Stock
M.A.C,M.A.C Lip Pencil - Caviar(1.45g),N/A,None,₹2300,N/A,No Discount,None,In Stock
M.A.C,M.A.C True Or False Lashes - 88 Stunner Lash(1Pair),5/5,1ratings,₹2150,N/A,No Discount,None,In Stock
M.A.C,M.A.C Macstack Mascara(12ml),N/A,None,₹3300,N/A,No Discount,None,In Stock
M.A.C,M.A.C Eye Love Surprises Eye Shadow Palette X 6 - Sparkling Wine Splash(8.4 g),1/5,1ratings,₹5000,N/A,No Discount,None,In Stock
M.A.C,M.A.C Love Me Liquid Lipcolour - I Vote For Me(3.1ml),4.2/5,160ratings&34reviews,₹2450,N/A,No Discount,None,In Stock
M.A.C,M.A.C Small Eye Shadow - Power To The Purple(1 gms),N/A,None,₹2150,N/A,No Discount,None,In Stock
M.A.C,M.A.C Squall Goals Eye Shadow Palette X6: Cabin Fever- Holiday Collection Cabin Fever(1 gms),5/5,1ratings,₹4800,N/A,No Discount,None,In Stock
M.A.C,M.A.C Macximal Matte Lipstick - Ring The Alarm(3.5g),N/A,None,₹2550,N/A,No Discount,None,In Stock
M.A.C,M.A.C Macximal Matte Lipstick - Avant Garnet(3.5g),N/A,None,₹2550,N/A,No Discount,None,In Stock
M.A.C,M.A.C Large Shader Brush - 252S,N/A,None,₹4500,N/A,No Discount,None,In Stock
M.A.C,M.A.C Eye Liner Brush - 209(15cm),4/5,8ratings,₹2450,N/A,No Discount,None,In Stock
M.A.C,M.A.C Macximal Matte Lipstick - You Wouldn'T Get It(3.5g),N/A,None,₹2550,N/A,No Discount,None,In Stock
M.A.C,M.A.C True Or False Lashes - 85 Sexpot Lash(1Pair),4.3/5,6ratings&1reviews,₹2150,N/A,No Discount,None,In Stock
M.A.C,M.A.C Macximal Matte Lipstick - Sugar Dada(3.5g),N/A,None,₹2550,N/A,No Discount,None,In Stock
M.A.C,M.A.C Powerglass Plumping Lip Gloss - Not Your Love Interest,4/5,118ratings&13reviews,₹1700,N/A,No Discount,None,In Stock
M.A.C,M.A.C Prep + Prime Skin Base Visage(30ml),4.5/5,292ratings&39reviews,₹2900,N/A,No Discount,None,Out Of Stock
M.A.C,"M.A.C Mini Hyper Real Fresh Canvas Cleansing Oil Makeup Remover With Niacinamide, Hyaluronic Acid & Ceramides(30ml)",4.3/5,112ratings&9reviews,₹1700,N/A,No Discount,None,Out Of Stock
M.A.C,M.A.C Extra Dimension Skinfinish - Beaming Blush(9gm),4/5,238ratings&38reviews,₹3550,N/A,No Discount,None,Out Of Stock
M.A.C,M.A.C Extended Play Gigablack Lash - Extended Play Gigablack (Intense Black)(5.7gm),4.4/5,172ratings&23reviews,₹2000,N/A,No Discount,None,Out Of Stock
M.A.C,M.A.C Stack Waterproof Mascara(1 gms),4.4/5,71ratings&7reviews,₹3300,N/A,No Discount,None,Out Of Stock
M.A.C,M.A.C Lipglass Lip Gloss(15ml),4.3/5,334ratings&44reviews,₹1700,N/A,No Discount,None,Out Of Stock
M.A.C,M.A.C Velvet Eye Shadow - Sketch(1.5g),4.6/5,74ratings&10reviews,₹2150,N/A,No Discount,None,Out Of Stock
M.A.C,M.A.C Frostbitten Kiss Lustreglass Lipstick X5- Holiday Collection Fresh Shades(1 gms),4.3/5,7ratings&1reviews,₹9000,N/A,No Discount,None,Out Of Stock
M.A.C,M.A.C In Extreme Dimension 3D Black Lash - 3D Black(12gm),4.5/5,95ratings&12reviews,₹2500,N/A,No Discount,None,Out Of Stock
M.A.C,M.A.C Prep + Prime Fix+ Setting Spray - Rose (Makeup Fixer)(100ml),4.5/5,17562ratings&2441reviews,₹1950,N/A,No Discount,None,Out Of Stock
M.A.C,M.A.C Ruby's Crew Powder Kiss Lipstick - Ruby New(3gm),4.2/5,54ratings&4reviews,₹2800,N/A,No Discount,None,Out Of Stock
M.A.C,M.A.C Studio Fix Pro Set + Blur Weightless Loose Powder - Translucent(1 gms),2.7/5,11ratings&1reviews,₹4200,N/A,No Discount,None,Out Of Stock
M.A.C,M.A.C Brushstroke Liner- Brushblack (Teddy Collection)(1 gms),4/5,1ratings&1reviews,₹3400,N/A,No Discount,None,Out Of Stock
M.A.C,M.A.C Lip Pencil - Sweet Talk(1.45g),2/5,1ratings,₹2300,N/A,No Discount,None,Out Of Stock
M.A.C,M.A.C Extra Dimension Skinfinish- Holiday Collection Gleamscape(1 gms),3.5/5,2ratings,₹4400,N/A,No Discount,None,Out Of Stock
M.A.C,M.A.C Fix+ Stayover Setting Spray (Teddy Collection)(1 gms),5/5,7ratings&2reviews,₹3250,N/A,No Discount,None,Out Of Stock
M.A.C,M.A.C Powder Kiss Liquid Lipcolour - Rhythm 'n' Roses(5ml),4.7/5,50ratings&1reviews,₹2450,N/A,No Discount,None,Out Of Stock
M.A.C,M.A.C Powder Blush - Power To You!(1 gms),5/5,2ratings,₹3000,N/A,No Discount,None,Out Of Stock
M.A.C,M.A.C Studio Fix Fluid SPF 15 Mini - NC15,4.4/5,16743ratings&975reviews,₹2100,N/A,No Discount,None,Out Of Stock
M.A.C,M.A.C For Real Hyper Real Serumizer Duo- Holiday Collection Na(1 gms),4.2/5,4ratings,₹6900,N/A,No Discount,None,Out Of Stock
M.A.C,M.A.C Pro Locked Brow Gel - Clear(1 gms),N/A,None,₹2700,N/A,No Discount,None,Out Of Stock
M.A.C,M.A.C Prep + Prime Skin Refined Zone(15ml),4.3/5,182ratings&11reviews,₹2100,N/A,No Discount,None,Out Of Stock
M.A.C,M.A.C Lustre Eye Shadow - Honey Lust(1.5g),5/5,4ratings,₹2150,N/A,No Discount,None,Out Of Stock
M.A.C,M.A.C Mineralize Skinfinish Natural - Dark(10gm),4.4/5,786ratings&104reviews,₹3950,N/A,No Discount,None,Out Of Stock
M.A.C,M.A.C True Or False Lashes - 80 Romantic Lash(1Pair),4.6/5,13ratings&1reviews,₹1500,N/A,No Discount,None,Out Of Stock
M.A.C,M.A.C Embroidered Opulence Collection(6 pcs),4.6/5,125ratings&25reviews,₹18900,N/A,No Discount,None,Out Of Stock
M.A.C,M.A.C Embroidered Opulence Collection(6 pcs),4.6/5,125ratings&25reviews,₹18900,N/A,No Discount,None,Out Of Stock
M.A.C,M.A.C Lipstick - Valentine Collection - Tropic Tonic (Matte Lipstick)(1 gms),4.4/5,182ratings&23reviews,₹2150,N/A,No Discount,None,Out Of Stock
M.A.C,M.A.C Lipstick / Mini - Chili(1.8g),4.4/5,29871ratings&5180reviews,₹1100,N/A,No Discount,None,Out Of Stock
M.A.C,M.A.C Lip Pencil Pearlescence Collection - Spice(1 gms),4.4/5,19ratings,₹2200,N/A,No Discount,None,Out Of Stock
M.A.C,"M.A.C Mini Hyper Real Fresh Canvas Cleansing Oil Makeup Remover With Niacinamide, Hyaluronic Acid & Ceramides(30ml)",4.3/5,112ratings&9reviews,₹1700,N/A,No Discount,None,Out Of Stock
M.A.C,M.A.C Lovestruck Luck Eyeshadow Palette(1 gms),N/A,None,₹4600,N/A,No Discount,None,Out Of Stock
M.A.C,M.A.C Matte Lipstick Pearlescence Collection - Velvet Teddy(1 gms),4/5,122ratings&13reviews,₹2150,N/A,No Discount,None,Out Of Stock
M.A.C,M.A.C Magic Extension Mascara(11ml),4.3/5,19ratings&1reviews,₹2550,N/A,No Discount,None,Out Of Stock
